identifier,file,description,title,creator,date,adaptive_ocr,better_pdf,mediatype,pinpoint,internet_archive
INFC_A-2018-078,atip-files/INFC ATIPS/INFC_A-2018-078.pdf,"Documents prepared for the meeting between Infrastructure Canada and Sidewalk Labs further to communication report 361287-424691.

Documents préparés pour la réunion d’Infrastructure Canada et de Sidewalk Labs à la suite de la présentation du rapport de communication 361287-424691.",A-2018-78,Infrastructure Canada | Infrastructure Canada,2019-04,TRUE,TRUE,text,NA,TRUE
INFC_A-2018-083,atip-files/INFC ATIPS/INFC_A-2018-083.pdf,"Documents prepared for the meeting between Infrastructure Canada and Sidewalk Labs further to communication report 361287-436715.

Documents préparés pour la réunion d’Infrastructure Canada et de Sidewalk Labs à la suite de la présentation du rapport de communication 361287-436715.",A-2018-83,Infrastructure Canada | Infrastructure Canada,2019-04,TRUE,TRUE,text,NA,TRUE
INFC_A-2018-087,atip-files/INFC ATIPS/INFC_A-2018-087.pdf,"Any notes taken during the meeting and documents prepared for the meeting between Infrastructure Canada and Sidewalk Labs further to communication report 361287-442080.

Toutes notes prisent pour la réunion d’Infrastructure Canada et de Sidewalk Labs à la suite de la présentation du rapport de communication 361287-442080.",A-2018-87,Infrastructure Canada | Infrastructure Canada,2019-03,TRUE,TRUE,text,NA,TRUE
INFC_A-2018-092,atip-files/INFC ATIPS/INFC_A-2018-092.pdf,"Note to the minister event-meeting between the Minister and the representatives of Northern Québec

Note à l'intention du Ministre - Événement - Rencontre entre le Ministre et les représentants du Nord du Québec",A-2018-92,Infrastructure Canada | Infrastructure Canada,2019-02,TRUE,TRUE,text,NA,TRUE
INFC_A-2018-093-1,atip-files/INFC ATIPS/INFC_A-2018-093-1.pdf,"Briefing materials for the new Rural Economic Development Minister.

Documents d'information pour la ministre du Développement économique rural.",A-2018-93,Infrastructure Canada | Infrastructure Canada,2019-05,TRUE,TRUE,text,NA,TRUE
INFC_A-2018-094,atip-files/INFC ATIPS/INFC_A-2018-094.pdf,"Major Bridge Projects - Champlain - Update on Construction of New Champlain Bridge Corridor Project.

Mise à jour sur la construction du projet de corridor du nouveau pont Champlain.",A-2018-94,Infrastructure Canada | Infrastructure Canada,2019-02,TRUE,TRUE,text,NA,TRUE
INFC_A-2018-096,atip-files/INFC ATIPS/INFC_A-2018-096.pdf,"Major Bridge Projects - Gordie - Scenario Note- Deputy Minister Meeting with the Windsor–Detroit Bridge Authority in November 2018

Grands projets de construction de ponts - Gordie - note de scénario - rencontre entre la sous-ministre et l'Autorité du pont Windsor-Détroit en novembre 2018",A-2018-96,Infrastructure Canada | Infrastructure Canada,2019-05,TRUE,TRUE,text,NA,TRUE
INFC_A-2018-097,atip-files/INFC ATIPS/INFC_A-2018-097.pdf,"Major Bridge Projects - Gordie - SN for Minister call with Michigan Whitmer.

Note de scenario pour l'appel du ministre avec Michigan Whitmer.",A-2018-97,Infrastructure Canada | Infrastructure Canada,2019-02,TRUE,TRUE,text,NA,TRUE
INFC_A-2018-098,atip-files/INFC ATIPS/INFC_A-2018-098.pdf,"Copy of note 2018IC049150 - Ontario Economic Fall Update.

Copie de note 2018IC049150 - Mise à jour économiques de l'automne de l'Ontario.",A-2018-98,Infrastructure Canada | Infrastructure Canada,2019-03,TRUE,TRUE,text,NA,TRUE
INFC_A-2018-099,atip-files/INFC ATIPS/INFC_A-2018-099.pdf,"2018IC048801 - Meeting Between Minister of Infrastructure and Communities and Sidewalk Labs.

2018IC048801 - Rencontre entre le ministre de l'Infrastructure et des Collectivités et Sidewalk Labs.",A-2018-99,Infrastructure Canada | Infrastructure Canada,2019-04,TRUE,TRUE,text,NA,TRUE
INFC_A-2018-100,atip-files/INFC ATIPS/INFC_A-2018-100.pdf,"Meeting with Caisse de dépôt et placement du Québec.

Réunion avec la Caisse de dépôt et placement du Québec.",A-2018-100,Infrastructure Canada | Infrastructure Canada,2019-02,TRUE,TRUE,text,NA,TRUE
INFC_A-2018-101,atip-files/INFC ATIPS/INFC_A-2018-101.pdf,"Major Bridge Projects - Gordie - SN for the Min-Gov briefing for call.

Note de scenario pour le briefing de l'appel entre le ministre et gouverneur.",A-2018-101,Infrastructure Canada | Infrastructure Canada,2019-02,TRUE,TRUE,text,NA,TRUE
INFC_A-2018-102,atip-files/INFC ATIPS/INFC_A-2018-102.pdf,"Meeting with Parliamentary Budget Officer

Réunion avec le directeur parlementaire du budget",A-2018-102,Infrastructure Canada | Infrastructure Canada,2019-02,TRUE,TRUE,text,NA,TRUE
INFC_A-2018-103,atip-files/INFC ATIPS/INFC_A-2018-103.pdf,"2018IC048739 - Meeting with the Canadian Electricity Association.

2018IC048739- Rencontre avec l'Association Canadienne de l'Électricité.",A-2018-103,Infrastructure Canada | Infrastructure Canada,2019-04,TRUE,TRUE,text,NA,TRUE
INFC_A-2018-104,atip-files/INFC ATIPS/INFC_A-2018-104.pdf,"Deputy Minister Meeting of the Science Coordination Group for Climate Change

Réunion de la sous-ministre et du groupe de coordination scientifique pour le changement climatique.",A-2018-104,Infrastructure Canada | Infrastructure Canada,2019-05,TRUE,TRUE,text,NA,TRUE
INFC_A-2018-105,atip-files/INFC ATIPS/INFC_A-2018-105.pdf,"2018IC048872 - One-Pager

2018IC048872- Document d'une page",A-2018-105,Infrastructure Canada | Infrastructure Canada,2019-04,TRUE,TRUE,text,NA,TRUE
INFC_A-2018-106,atip-files/INFC ATIPS/INFC_A-2018-106.pdf,"Canadian Chamber of Commerce Roundtable discussion

La discussion de la Chambre de commerce du Canada",A-2018-106,Infrastructure Canada | Infrastructure Canada,2019-02,TRUE,TRUE,text,NA,TRUE
INFC_A-2018-107,atip-files/INFC ATIPS/INFC_A-2018-107.pdf,"Canada core public infrastructure survey: wastewater assets and solid waste assets

Enquête sur les infrastructures publiques de base au Canada: actifs liés aux usées et aux déchets solides",A-2018-107,Infrastructure Canada | Infrastructure Canada,2019-02,TRUE,TRUE,text,NA,TRUE
INFC_A-2018-108-1,atip-files/INFC ATIPS/INFC_A-2018-108-1.pdf,"Final copy of the communication plan, briefing documents prepared for briefing the media, and documents prepared for the public from the Infrastructure Canada Communications team during the preparation phase of the new Samuel de Champlain bridge for the period from January 1, 2010 to May 31 2015.

Copie finale du plan de communication, des documents préparés pour les briefing techniques aux médias et des documents préparés pour le public de l’équipe de Communication à Infrastructure Canada pendant la phase préparatoire du projet de la construction du nouveau pont Samuel-de-Champlain pour la période du 1 janvier 2010 au 31 mai 2015.",A-2018-108,Infrastructure Canada | Infrastructure Canada,2019-04,TRUE,TRUE,text,NA,TRUE
INFC_A-2018-108-2,atip-files/INFC ATIPS/INFC_A-2018-108-2.pdf,"Final copy of the communication plan, briefing documents prepared for briefing the media, and documents prepared for the public from the Infrastructure Canada Communications team during the preparation phase of the new Samuel de Champlain bridge for the period from January 1, 2010 to May 31 2015.

Copie finale du plan de communication, des documents préparés pour les briefing techniques aux médias et des documents préparés pour le public de l’équipe de Communication à Infrastructure Canada pendant la phase préparatoire du projet de la construction du nouveau pont Samuel-de-Champlain pour la période du 1 janvier 2010 au 31 mai 2015.",A-2018-108,Infrastructure Canada | Infrastructure Canada,2019-04,TRUE,TRUE,text,NA,TRUE
INFC_A-2018-109-1,atip-files/INFC ATIPS/INFC_A-2018-109-1.pdf,"A final copy of the communication plan, documents prepared for technical briefings to the media and documents prepared for the public from the communication team at Infrastructure Canada during the construction of the new Samuel-De Champlain Bridge from June 1, 2015 to January 16, 2019.

Une copie finale du plan de communication, des documents préparés pour les briefing techniques aux médias et des documents préparé pour le public de l’équipe de Communication à Infrastructure Canada pendant la construction du nouveau pont Samuel-de-Champlain pour la période du 1 juin 2015 au 16 janvier 2019.",A-2018-109,Infrastructure Canada | Infrastructure Canada,2019-06,TRUE,TRUE,text,NA,TRUE
INFC_A-2018-109-2,atip-files/INFC ATIPS/INFC_A-2018-109-2.pdf,"A final copy of the communication plan, documents prepared for technical briefings to the media and documents prepared for the public from the communication team at Infrastructure Canada during the construction of the new Samuel-De Champlain Bridge from June 1, 2015 to January 16, 2019.

Une copie finale du plan de communication, des documents préparés pour les briefing techniques aux médias et des documents préparé pour le public de l’équipe de Communication à Infrastructure Canada pendant la construction du nouveau pont Samuel-de-Champlain pour la période du 1 juin 2015 au 16 janvier 2019.",A-2018-109,Infrastructure Canada | Infrastructure Canada,2019-06,TRUE,TRUE,text,NA,TRUE
INFC_A-2018-110,atip-files/INFC ATIPS/INFC_A-2018-110.pdf,"Briefing notes and correspondence as well as all studies or data submitted to or prepared for the Minister of Infrastructure and Communities or his senior officials in preparation for and during his trip to the North Shore region of Quebec in January 2019.

Notes d'ìnformation et de correspondance, ainsi quà toutes études ou données ayant été remis ou préparé pour le Ministre de lìnfastructure et des Collectivités ou pour ses hautes-fonctionnaires en vue- et lors- de son voyage dans la région québécois de la cote-nord en janvier 2019.",A-2018-110,Infrastructure Canada | Infrastructure Canada,2019-03,TRUE,TRUE,text,NA,TRUE
INFC_A-2018-114-1,atip-files/INFC ATIPS/INFC_A-2018-114-1.pdf,"Documents designed to help Rural Economic Development Minister Bernadette Jordan get familiarized with her cabinet portfolio.

Documents conçus pour aider la ministre du Développement économique rural à se familiariser avec son portefeuille.",A-2018-114,Infrastructure Canada | Infrastructure Canada,2019-05,TRUE,TRUE,text,NA,TRUE
INFC_A-2018-114-2,atip-files/INFC ATIPS/INFC_A-2018-114-2.pdf,"Documents designed to help Rural Economic Development Minister Bernadette Jordan get familiarized with her cabinet portfolio.

Documents conçus pour aider la ministre du Développement économique rural à se familiariser avec son portefeuille.",A-2018-114,Infrastructure Canada | Infrastructure Canada,2019-05,TRUE,TRUE,text,NA,TRUE
INFC_A-2018-115,atip-files/INFC ATIPS/INFC_A-2018-115.pdf,"The briefing binder given to the Minister of Rural Economic Development in January 2019 (partial briefing binder).

Les cahier d'information remis au ministre du Développement économique rural en janvier 2019 (cahier d'information partiel).",A-2018-115,Infrastructure Canada | Infrastructure Canada,2019-04,TRUE,TRUE,text,NA,TRUE
INFC_A-2018-117,atip-files/INFC ATIPS/INFC_A-2018-117.pdf,"All official documents of Signature on the Saint Lawrence (SSL) requesting payment to Infrastructure Canada, whether accepted or refused, from January 1, 2016 to March 5, 2019. Do not include supporting documents, only the description of each expense.

Tous les documents officiels du consortium Signature sur St-Laurent (SSL) demandant un paiement à Infrastructures Canada qu'ils soient acceptés ou refusés depuis 1er janvier 2016 jusqu'à aujourd'hui (le 5 mars 2019). Ne pas inclure les pièces justificatives, seulement la description de chaque dépense.",A-2018-117,Infrastructure Canada | Infrastructure Canada,2019-06,TRUE,TRUE,text,NA,TRUE
INFC_A-2018-118,atip-files/INFC ATIPS/INFC_A-2018-118.pdf,"Obtain a complete copy of all briefing notes/memoranda/QP notes of the Minister responsible for Infrastructure Canada in relation to his visit to Sept-Îles, Baie-Comeau, and other stops along the Côte-Nord from January 10, 2019 to date (March 5, 2019).

Obtenir copie complète de toutes les note/mémorandums QP notes du ministre responsable d’Infrastructure Canada en lien avec sa visite à Sept-Iles. Baie-Comeau et autres arrêts sur la Cote-Nord entre le 10 janvier 2019 à ce jour, le 5 mars 2019.",A-2018-118,Infrastructure Canada | Infrastructure Canada,2019-05,TRUE,TRUE,text,NA,TRUE
INFC_A-2018-120,atip-files/INFC ATIPS/INFC_A-2018-120.pdf,"Task and Solutions Professional Services (TSPS) and Task Based Informatics Professional Services (TBIPS) Supply Arrangement (SA) contracts and Standing Offer (SO) callups issued in the National Capital Region for the months of October, November and December 2018.

Contrats d’arrangement en matière d’approvisionnement (AA) des Services professionnels centrés sur les tâches et les solutions (SPTS) et des services professionnels en informatique centré sur les tâches (SPICT), ainsi que les offres à commandes (OC) émises dans la région de la capitale nationale pour les mois d’octobre, novembre et décembre 2018.",A-2018-120,Infrastructure Canada | Infrastructure Canada,2019-03,TRUE,TRUE,text,NA,TRUE
INFC_A-2018-121,atip-files/INFC ATIPS/INFC_A-2018-121.pdf,"Temporary Help Services (THS) Supply Arrangement (SA) and Standing Offer (SO) callups issued in the National Capital Region for the months October, November and December 2018.

Les commandes subséquentes aux arrangements en matière d'approvisionnement et aux offres à commande pour les services d'aide temporaire publiées dans la région de la capitale nationale entre les mois d’octobre, novembre et décembre 2018.",A-2018-121,Infrastructure Canada | Infrastructure Canada,2019-03,TRUE,TRUE,text,NA,TRUE
INFC_A-2018-122,atip-files/INFC ATIPS/INFC_A-2018-122.pdf,"ProServices contracts issued in the National Capital Region for the months of October, November and December 2018. Please provide copies of contracts.

Ensemble des contrats de services professionnels attribués dans la région de la capitale nationale pour les mois de novembre et décembre 2018. Veuillez fournir des copies des marchés.",A-2018-122,Infrastructure Canada | Infrastructure Canada,2019-03,TRUE,TRUE,text,NA,TRUE
INFC_A-2018-123-1,atip-files/INFC ATIPS/INFC_A-2018-123-1.pdf,"Documents regarding Sidewalk labs and Waterfront Toronto's Master Innovation and Development Plan for the Quayside Development. Timeline: June 2018 to March 12, 2019.

Documents concernant Sidewalk labs et le plan directeur d’innovation et de développement de Quayside de Waterfront Toronto. Échéance : juin 2019 au 12 mars 2019.",A-2018-123,Infrastructure Canada | Infrastructure Canada,2019-12,TRUE,TRUE,text,NA,TRUE
INFC_A-2018-123-2,atip-files/INFC ATIPS/INFC_A-2018-123-2.pdf,"Documents regarding Sidewalk labs and Waterfront Toronto's Master Innovation and Development Plan for the Quayside Development. Timeline: June 2018 to March 12, 2019.

Documents concernant Sidewalk labs et le plan directeur d’innovation et de développement de Quayside de Waterfront Toronto. Échéance : juin 2019 au 12 mars 2019.",A-2018-123,Infrastructure Canada | Infrastructure Canada,2019-12,TRUE,TRUE,text,NA,TRUE
INFC_A-2018-123-3,atip-files/INFC ATIPS/INFC_A-2018-123-3.pdf,"Documents regarding Sidewalk labs and Waterfront Toronto's Master Innovation and Development Plan for the Quayside Development. Timeline: June 2018 to March 12, 2019.

Documents concernant Sidewalk labs et le plan directeur d’innovation et de développement de Quayside de Waterfront Toronto. Échéance : juin 2019 au 12 mars 2019.",A-2018-123,Infrastructure Canada | Infrastructure Canada,2019-12,TRUE,TRUE,text,NA,TRUE
INFC_A-2018-123-4,atip-files/INFC ATIPS/INFC_A-2018-123-4.pdf,"Documents regarding Sidewalk labs and Waterfront Toronto's Master Innovation and Development Plan for the Quayside Development. Timeline: June 2018 to March 12, 2019.

Documents concernant Sidewalk labs et le plan directeur d’innovation et de développement de Quayside de Waterfront Toronto. Échéance : juin 2019 au 12 mars 2019.",A-2018-123,Infrastructure Canada | Infrastructure Canada,2019-12,TRUE,TRUE,text,NA,TRUE
INFC_A-2018-125-1,atip-files/INFC ATIPS/INFC_A-2018-125-1.pdf,"Documents between Waterfront Toronto and Infrastructure Canada for the period of July 2018 to present (March 12, 2019). Please exclude cabinet confidences.

Les documents entre Waterfront Toronto et Infrastructure Canada pour la période de juillet 2018 à aujourd’hui (12 mars 2019). Veuillez exclure les documents confidentiels du Cabinet.",A-2018-125,Infrastructure Canada | Infrastructure Canada,2020-01,TRUE,TRUE,text,NA,TRUE
INFC_A-2018-125-2,atip-files/INFC ATIPS/INFC_A-2018-125-2.pdf,"Documents between Waterfront Toronto and Infrastructure Canada for the period of July 2018 to present (March 12, 2019). Please exclude cabinet confidences.

Les documents entre Waterfront Toronto et Infrastructure Canada pour la période de juillet 2018 à aujourd’hui (12 mars 2019). Veuillez exclure les documents confidentiels du Cabinet.",A-2018-125,Infrastructure Canada | Infrastructure Canada,2020-01,TRUE,TRUE,text,NA,TRUE
INFC_A-2018-125-3,atip-files/INFC ATIPS/INFC_A-2018-125-3.pdf,"Documents between Waterfront Toronto and Infrastructure Canada for the period of July 2018 to present (March 12, 2019). Please exclude cabinet confidences.

Les documents entre Waterfront Toronto et Infrastructure Canada pour la période de juillet 2018 à aujourd’hui (12 mars 2019). Veuillez exclure les documents confidentiels du Cabinet.",A-2018-125,Infrastructure Canada | Infrastructure Canada,2020-01,TRUE,TRUE,text,NA,TRUE
INFC_A-2018-126,atip-files/INFC ATIPS/INFC_A-2018-126.pdf,"Documents between Sidewalk Labs and Infrastructure Canada for the period of November 2017 to present (March 12, 2019). Please exclude cabinet confidences.

Documents entre Sidewalk Labs et Infrastructure Canada pour la période de novembre 2017 à aujourd’hui (12 mars 2019). Veuillez exclure les confidences de cabinet.",A-2018-126,Infrastructure Canada | Infrastructure Canada,2019-08,TRUE,TRUE,text,NA,TRUE
INFC_A-2018-127,atip-files/INFC ATIPS/INFC_A-2018-127.pdf,"A copy of the most recent painting cost estimate of the Quebec Bridge, as well as the invoice of the company that made this estimate.

Une copie de la plus récente estimation des coûts de peinture du pont de Québec, de même que la facture de la firme qui a réalisé cette estimation.",A-2018-127,Infrastructure Canada | Infrastructure Canada,2019-06,TRUE,TRUE,text,NA,TRUE
INFC_A-2019-001-1,atip-files/INFC ATIPS/INFC_A-2019-001-1.pdf,"Records pertaining to the assessment process of determining the Smart Cities Challenge winners further to the final proposals received in relation to the March 5, 2019 submission deadline and any immediate reactions. Timeline: March 1, 2019 to April 2, 2019.

Dossiers ayant trait au processus d’évaluation pour déterminer les gagnants du Défi des villes intelligentes quant aux propositions finales en ce qui a trait à l’échéance de présentation du 5 mars 2019 et aux réactions immédiates. Échéance : 1er mars au 2 avril 2019.",A-2019-1,Infrastructure Canada | Infrastructure Canada,2019-12,TRUE,TRUE,text,NA,TRUE
INFC_A-2019-001-10,atip-files/INFC ATIPS/INFC_A-2019-001-10.pdf,"Records pertaining to the assessment process of determining the Smart Cities Challenge winners further to the final proposals received in relation to the March 5, 2019 submission deadline and any immediate reactions. Timeline: March 1, 2019 to April 2, 2019.

Dossiers ayant trait au processus d’évaluation pour déterminer les gagnants du Défi des villes intelligentes quant aux propositions finales en ce qui a trait à l’échéance de présentation du 5 mars 2019 et aux réactions immédiates. Échéance : 1er mars au 2 avril 2019.",A-2019-1,Infrastructure Canada | Infrastructure Canada,2019-12,TRUE,TRUE,text,NA,TRUE
INFC_A-2019-001-11,atip-files/INFC ATIPS/INFC_A-2019-001-11.pdf,"Records pertaining to the assessment process of determining the Smart Cities Challenge winners further to the final proposals received in relation to the March 5, 2019 submission deadline and any immediate reactions. Timeline: March 1, 2019 to April 2, 2019.

Dossiers ayant trait au processus d’évaluation pour déterminer les gagnants du Défi des villes intelligentes quant aux propositions finales en ce qui a trait à l’échéance de présentation du 5 mars 2019 et aux réactions immédiates. Échéance : 1er mars au 2 avril 2019.",A-2019-1,Infrastructure Canada | Infrastructure Canada,2019-12,TRUE,TRUE,text,NA,TRUE
INFC_A-2019-001-12,atip-files/INFC ATIPS/INFC_A-2019-001-12.pdf,"Records pertaining to the assessment process of determining the Smart Cities Challenge winners further to the final proposals received in relation to the March 5, 2019 submission deadline and any immediate reactions. Timeline: March 1, 2019 to April 2, 2019.

Dossiers ayant trait au processus d’évaluation pour déterminer les gagnants du Défi des villes intelligentes quant aux propositions finales en ce qui a trait à l’échéance de présentation du 5 mars 2019 et aux réactions immédiates. Échéance : 1er mars au 2 avril 2019.",A-2019-1,Infrastructure Canada | Infrastructure Canada,2019-12,TRUE,TRUE,text,NA,TRUE
INFC_A-2019-001-13,atip-files/INFC ATIPS/INFC_A-2019-001-13.pdf,"Records pertaining to the assessment process of determining the Smart Cities Challenge winners further to the final proposals received in relation to the March 5, 2019 submission deadline and any immediate reactions. Timeline: March 1, 2019 to April 2, 2019.

Dossiers ayant trait au processus d’évaluation pour déterminer les gagnants du Défi des villes intelligentes quant aux propositions finales en ce qui a trait à l’échéance de présentation du 5 mars 2019 et aux réactions immédiates. Échéance : 1er mars au 2 avril 2019.",A-2019-1,Infrastructure Canada | Infrastructure Canada,2019-12,TRUE,TRUE,text,NA,TRUE
INFC_A-2019-001-14,atip-files/INFC ATIPS/INFC_A-2019-001-14.pdf,"Records pertaining to the assessment process of determining the Smart Cities Challenge winners further to the final proposals received in relation to the March 5, 2019 submission deadline and any immediate reactions. Timeline: March 1, 2019 to April 2, 2019.

Dossiers ayant trait au processus d’évaluation pour déterminer les gagnants du Défi des villes intelligentes quant aux propositions finales en ce qui a trait à l’échéance de présentation du 5 mars 2019 et aux réactions immédiates. Échéance : 1er mars au 2 avril 2019.",A-2019-1,Infrastructure Canada | Infrastructure Canada,2019-12,TRUE,TRUE,text,NA,TRUE
INFC_A-2019-001-2,atip-files/INFC ATIPS/INFC_A-2019-001-2.pdf,"Records pertaining to the assessment process of determining the Smart Cities Challenge winners further to the final proposals received in relation to the March 5, 2019 submission deadline and any immediate reactions. Timeline: March 1, 2019 to April 2, 2019.

Dossiers ayant trait au processus d’évaluation pour déterminer les gagnants du Défi des villes intelligentes quant aux propositions finales en ce qui a trait à l’échéance de présentation du 5 mars 2019 et aux réactions immédiates. Échéance : 1er mars au 2 avril 2019.",A-2019-1,Infrastructure Canada | Infrastructure Canada,2019-12,TRUE,TRUE,text,NA,TRUE
INFC_A-2019-001-3,atip-files/INFC ATIPS/INFC_A-2019-001-3.pdf,"Records pertaining to the assessment process of determining the Smart Cities Challenge winners further to the final proposals received in relation to the March 5, 2019 submission deadline and any immediate reactions. Timeline: March 1, 2019 to April 2, 2019.

Dossiers ayant trait au processus d’évaluation pour déterminer les gagnants du Défi des villes intelligentes quant aux propositions finales en ce qui a trait à l’échéance de présentation du 5 mars 2019 et aux réactions immédiates. Échéance : 1er mars au 2 avril 2019.",A-2019-1,Infrastructure Canada | Infrastructure Canada,2019-12,TRUE,TRUE,text,NA,TRUE
INFC_A-2019-001-4,atip-files/INFC ATIPS/INFC_A-2019-001-4.pdf,"Records pertaining to the assessment process of determining the Smart Cities Challenge winners further to the final proposals received in relation to the March 5, 2019 submission deadline and any immediate reactions. Timeline: March 1, 2019 to April 2, 2019.

Dossiers ayant trait au processus d’évaluation pour déterminer les gagnants du Défi des villes intelligentes quant aux propositions finales en ce qui a trait à l’échéance de présentation du 5 mars 2019 et aux réactions immédiates. Échéance : 1er mars au 2 avril 2019.",A-2019-1,Infrastructure Canada | Infrastructure Canada,2019-12,TRUE,TRUE,text,NA,TRUE
INFC_A-2019-001-5,atip-files/INFC ATIPS/INFC_A-2019-001-5.pdf,"Records pertaining to the assessment process of determining the Smart Cities Challenge winners further to the final proposals received in relation to the March 5, 2019 submission deadline and any immediate reactions. Timeline: March 1, 2019 to April 2, 2019.

Dossiers ayant trait au processus d’évaluation pour déterminer les gagnants du Défi des villes intelligentes quant aux propositions finales en ce qui a trait à l’échéance de présentation du 5 mars 2019 et aux réactions immédiates. Échéance : 1er mars au 2 avril 2019.",A-2019-1,Infrastructure Canada | Infrastructure Canada,2019-12,TRUE,TRUE,text,NA,TRUE
