identifier,file,description,title,creator,date,adaptive_ocr,better_pdf,mediatype,pinpoint,internet_archive
DOJ_A-2016-00395,atip-files/DOJ ATIPS/DOJ_A-2016-00395.pdf,"Information from 2007 to 2011: terms and conditions of employment of excluded and unrepresented employees; communications informing employees of the directives regarding leave requests; communications about the ""iCase"" system.

Renseignements suivants de 2007 à 2011: termes et conditions d’emploi des employés exclus et non représentés; communications informant les employés des consignes applicables aux demandes de congé; communications sur le système de ""ICase"".",A-2016-00395,Department of Justice Canada | Ministère de la Justice Canada,2016-07,TRUE,TRUE,text,TRUE,TRUE
DOJ_A-2016-00415,atip-files/DOJ ATIPS/DOJ_A-2016-00415.pdf,"2005 Department of Justice ( justresearch ) issue 15, research area 13, northern New Brunswick report. author unkown. please refer to http://www.justice.gc.ca/eng/rp-pr/jr/jr15/p5.html.

Numéro 15 de JusteRecherche du ministère de la Justice (2005), secteur de recherche 13, rapport sur la partie nord du Nouveau-Brunswick. Auteur inconnu. Prière de consulter le site http://www.justice.gc.ca/fra/rp-pr/jr/jr15/p5.html.",A-2016-00415,Department of Justice Canada | Ministère de la Justice Canada,2016-07,TRUE,TRUE,text,TRUE,TRUE
DOJ_A-2016-00452,atip-files/DOJ ATIPS/DOJ_A-2016-00452.pdf,"All documents the Minister of Justice Canada has on the case of former Lieutenant-Governor of Quebec Lise Thibault, from January 1, 2005, to today, June 10, 2016.

Tout document que détient le ministère de la Justice du Canada dans le dossier de l'ancienne lieutenant-gouverneur du Québec Lise Thibault et ce depuis le 1 er janvier 2005 à ce jour, le 10 juin 2016.",A-2016-00452,Department of Justice Canada | Ministère de la Justice Canada,2016-07,TRUE,TRUE,text,TRUE,TRUE
DOJ_A-2016-00458,atip-files/DOJ ATIPS/DOJ_A-2016-00458.pdf,"All documents produced or received by the department that reference the Quebec student strike and Quebec student protests between December 1, 2011, and July 31, 2012.

Tous les documents produits ou reçus par le Ministère qui, entre le 1erdécembre 2011 et le 31 juillet 2012, ont parlé de la grève étudiante et des manifestations étudiantes survenues au Québec.",A-2016-00458,Department of Justice Canada | Ministère de la Justice Canada,2016-07,TRUE,TRUE,text,TRUE,TRUE
DOJ_A-2016-00461,atip-files/DOJ ATIPS/DOJ_A-2016-00461.pdf,"All service contracts and Public Service employment contracts of any tenure and associated payment records for Mme Monique Boudrias, President, Excellence R.H.R. Consultation Inc. for the period starting January 1, 2012, to June 20, 2016.

Tous les contrats de service et les contrats d'emploi à la fonction publique de quelque durée que ce soit, et les documents de paiement connexes, concernant Mme Monique Boudrias, présidente d'Excellence R.H.R. Consultation Inc., pour la période allant du 1er janvier 2012 au 20 juin 2016.",A-2016-00461,Department of Justice Canada | Ministère de la Justice Canada,2016-07,TRUE,TRUE,text,TRUE,TRUE
DOJ_A-2016-00484,atip-files/DOJ ATIPS/DOJ_A-2016-00484.pdf,"List of companies that have been used to purchase copy paper and toner by the Department of Justice Canada, for January 1, 2015, to June 24, 2016.

Liste des entreprises auprès desquelles le ministère de la Justice du Canada s'est procuré du papier à photocopie et de l'encre en poudre entre le 1er janvier 2015 et le 24 juin 2016.",A-2016-00484,Department of Justice Canada | Ministère de la Justice Canada,2016-07,TRUE,TRUE,text,TRUE,TRUE
DOJ_A-2016-00492,atip-files/DOJ ATIPS/DOJ_A-2016-00492.pdf,"Memos and briefing notes circulated at the associate deputy minister level and above from February 1, 2016, to June 27, 2016, concerning the department's review of outstanding litigation.

Les notes de service et les notes d'information communiquées au niveau de sous-ministre adjoint et aux niveaux supérieurs du 1er février 2016 au 27 juin 2016 concernant l'examen par le Ministère des litiges en suspens.",A-2016-00492,Department of Justice Canada | Ministère de la Justice Canada,2016-08,TRUE,TRUE,text,TRUE,TRUE
DOJ_A-2016-00500,atip-files/DOJ ATIPS/DOJ_A-2016-00500.pdf,"Research study: Results from RSDs Innovative Strategic Data Analysis and Forward Looking Research Program.

Étude de recherche : Results from RSDs Innovative Strategic Data Analysis and Forward Looking Research Program.",A-2016-00500,Department of Justice Canada | Ministère de la Justice Canada,2016-07,TRUE,TRUE,text,TRUE,TRUE
DOJ_A-2016-00501,atip-files/DOJ ATIPS/DOJ_A-2016-00501.pdf,"Research study: Exemptions from Mandatory Minimum Penalties: Recent Developments in Selected Countries.

Étude de recherche : Exemptions from Mandatory Minimum Penalties: Recent Developments in Selected Countries.",A-2016-00501,Department of Justice Canada | Ministère de la Justice Canada,2016-07,TRUE,TRUE,text,TRUE,TRUE
DOJ_A-2016-00517,atip-files/DOJ ATIPS/DOJ_A-2016-00517.pdf,"A breakdown of financial costs associated with the federal government's legal battle to maintain the Criminal Code prohibition on medical assistance in dying, by fiscal year, starting in 2011-12 and ending in 2016-17.

La ventilation des coûts financiers associés à la bataille juridique du gouvernement fédéral visant à conserver dans le Code criminel l'interdiction relative à l'aide médicale à mourir, par exercice financier, de l'exercice 2011-2012 à l'exercice 2016-2017.",A-2016-00517,Department of Justice Canada | Ministère de la Justice Canada,2016-08,TRUE,TRUE,text,TRUE,TRUE
DOJ_A-2016-00523,atip-files/DOJ ATIPS/DOJ_A-2016-00523.pdf,"Any reports, briefing notes, papers or summaries concerning any big data or data analysis projects or pilot projects operating within Justice Canada 2014 to June 2016.

Tout rapport, note d'information, article ou résumé concernant des projets d'analyse de données massives, des projets d'analyse des données ou des projets pilotes menés au ministère de la Justice entre 2014 et juin 2016.",A-2016-00523,Department of Justice Canada | Ministère de la Justice Canada,2016-08,TRUE,TRUE,text,TRUE,TRUE
DOJ_A-2016-00524,atip-files/DOJ ATIPS/DOJ_A-2016-00524.pdf,"Information relating to the analysis of Tsetsaut Skii kIn Lax Ha Nation's and/or Skii km Lax Ha Nation's strength of claim over any and all of its asserted territory,

Information concernant l'analyse de la solidité de la revendication de la nation Tsetsaut Skii kIn Lax Ha ou Skii km Lax Ha sur la totalité ou une partie du territoire revendiqué.",A-2016-00524,Department of Justice Canada | Ministère de la Justice Canada,2016-12,TRUE,TRUE,text,TRUE,TRUE
DOJ_A-2016-00531,atip-files/DOJ ATIPS/DOJ_A-2016-00531.pdf,"Copies of the following briefing materials listed in Order Paper Question 142; 2015-012749; 2015-012760; 2015-012774; 20 15-0 12831; 2015-012835; 2015-16,to 2017-1812015-012960; 20 15-013007; 2015-013051; 2015-013591.

Copies des documents d'information suivants figurant sur le document de Question à inscrire au feuilleton 142; 2015-012749; 2015-012760; 2015-012774; 20 15-0 12831; 2015-012835; 2015-16, à 2017-1812015-012960; 20 15-013007; 2015-013051; 2015-013591.",A-2016-00531,Department of Justice Canada | Ministère de la Justice Canada,2016-08,TRUE,TRUE,text,TRUE,TRUE
DOJ_A-2016-00538,atip-files/DOJ ATIPS/DOJ_A-2016-00538.pdf,"All emails, notes and other correspondence related to Order Paper Question Q-172 for the time period of April 28, 2016, through June 14, 2016, inclusive.

Tous les courriels, notes et autres articles de correspondance concernant la Q-172 inscrite au Feuilleton, pour la période allant du 28 avril 2016 au 14 juin 2016 inclusivement.",A-2016-00538,Department of Justice Canada | Ministère de la Justice Canada,2016-07,TRUE,TRUE,text,TRUE,TRUE
DOJ_A-2016-00545,atip-files/DOJ ATIPS/DOJ_A-2016-00545.pdf,"All receipts, invoices or bills submitted for travel, accommodations, and hospitality for Minister Jody Wilson-Raybould, between November 4, 2015, and to present ( June 27 , 2016).

Tout reçu, facture ou note de frais soumis relativement à des dépenses liées aux voyages, à l'hébergement et à l'accueil pour la ministre Jody Wilson-Raybould entre le 4 novembre 2015 et aujourd'hui (le 27 juin 2016).",A-2016-00545,Department of Justice Canada | Ministère de la Justice Canada,2016-08,TRUE,TRUE,text,TRUE,TRUE
DOJ_A-2016-00557,atip-files/DOJ ATIPS/DOJ_A-2016-00557.pdf,"BN 2016-001094, BN 2015-014182, BN 2015-012752, BN 2016-001902, BN 2016-002951, BN 2016-003214.

Note d'information 2016-001094, note d'information 2015-014182, note d'information 2015-012752, note d'information 2016-001902, note d'information 2016-002951, note d'information 2016-003214.",A-2016-00557,Department of Justice Canada | Ministère de la Justice Canada,2016-08,TRUE,TRUE,text,TRUE,TRUE
DOJ_A-2016-00558,atip-files/DOJ ATIPS/DOJ_A-2016-00558.pdf,"All assessments and reports dated from January 1, 2006, to July 11, 2016, of the crimes against humanity and war crimes program.

Tous les rapports et les évaluations datés entre le 1er janvier 2006 et le 11 juillet 2016 du Programme sur les crimes contre l'humanité et les crimes de guerre.",A-2016-00558,Department of Justice Canada | Ministère de la Justice Canada,2016-08,TRUE,TRUE,text,TRUE,TRUE
DOJ_A-2016-00574,atip-files/DOJ ATIPS/DOJ_A-2016-00574.pdf,"Documents provided for the access to information request A-2015-01712.

Documents transmis dans la demande d'accès à l'information numéro A-2015-01712.",A-2016-00574,Department of Justice Canada | Ministère de la Justice Canada,2016-07,TRUE,TRUE,text,TRUE,TRUE
DOJ_A-2016-00610,atip-files/DOJ ATIPS/DOJ_A-2016-00610.pdf,"Records (but not simple email correspondence) dated January 2010, to July 20, 2016, addressing what is known as the ""intelligence-to-evidence"" issue.

Documents (mais non la simple correspondance électronique) portant sur ce qu’on appelle l'utilisation du « renseignement en preuve », de janvier 2010 au 20 juillet 2016.",A-2016-00610,Department of Justice Canada | Ministère de la Justice Canada,2017-04,TRUE,TRUE,text,TRUE,TRUE
DOJ_A-2016-00624,atip-files/DOJ ATIPS/DOJ_A-2016-00624.pdf,"Documents pertaining to employer-supported volunteer schemes.

Documents portant sur des initiatives de bénévolat appuyées par les employeurs.",A-2016-00624,Department of Justice Canada | Ministère de la Justice Canada,2016-08,TRUE,TRUE,text,TRUE,TRUE
DOJ_A-2016-00627,atip-files/DOJ ATIPS/DOJ_A-2016-00627.pdf,"Legal fee costs and disbursements related to {Stacey Shiner (in her personal capacity and as Guardian of Josey K. Willier) v Attorney General of Canada,} Federal Court T-492-16 dated or likely to be dated between January 25, 2016, to July 26, 2016.

Les frais juridiques et les débours liés à {Stacey Shiner (en sa qualité personnelle et en tant que tutrice de Josey K. Willier) c. Procureur général du Canada,} Cour fédérale T-492-16 datés ou probablement datés entre le 25 janvier 2016 et le 26 juillet 2016.",A-2016-00627,Department of Justice Canada | Ministère de la Justice Canada,2016-08,TRUE,TRUE,text,TRUE,TRUE
DOJ_A-2016-00639,atip-files/DOJ ATIPS/DOJ_A-2016-00639.pdf,"Briefing materials listed in Order Paper Question 142 (Title/Internal tracking number): BN 2016-001044; BN 2016-001746; BN 2016-003318; BN2016-003870 and BN 2016-004798.

Documents de breffage indiqués dans la question au Feuilleton no 142 (titre/numéro de suivi interne) : NB 2016-001044; NB 2016-001746; NB 2016-003318; NB 2016-003870; et NB 2016-004798.",A-2016-00639,Department of Justice Canada | Ministère de la Justice Canada,2017-05,TRUE,TRUE,text,TRUE,TRUE
DOJ_A-2016-00640,atip-files/DOJ ATIPS/DOJ_A-2016-00640.pdf,"Briefing materials listed in Order Paper Question 142 (Title/Internal tracking number): Briefing note 2016-000165, 2016-000696, 2016-000804 and 2016-001015.

Documents d’information indiqués à la question 142 inscrite au Feuilleton (Titre/Numéro de référence interne) : Notes d'information 2016-000165, 2016-000696, 2016-000804 et 2016-001015.",A-2016-00640,Department of Justice Canada | Ministère de la Justice Canada,2016-11,TRUE,TRUE,text,TRUE,TRUE
DOJ_A-2016-00670,atip-files/DOJ ATIPS/DOJ_A-2016-00670.pdf,"Listing of various letters and notices regarding theTown of Fort Qu’Appelle.

Liste de diverses lettres et avis concernant la Ville de Fort Qu’Appelle.",A-2016-00670,Department of Justice Canada | Ministère de la Justice Canada,2016-11,TRUE,TRUE,text,TRUE,TRUE
DOJ_A-2016-00703,atip-files/DOJ ATIPS/DOJ_A-2016-00703.pdf,"All pension or retirement related training, courses or development provided to Ontario Regional Office employees or staff, during each of the calendar years 2005 to 2009, including costs.

Toutes les formations, tous les cours ou tout le perfectionnement sur la pension ou la retraite offerts aux employés du Bureau régional de l'Ontario pendant chaque année civile de 2005 à 2009, y compris les coûts.",A-2016-00703,Department of Justice Canada | Ministère de la Justice Canada,2016-08,TRUE,TRUE,text,TRUE,TRUE
DOJ_A-2016-00710,atip-files/DOJ ATIPS/DOJ_A-2016-00710.pdf,"Documents produced or revised after January 26, 2016, regarding the First Nations Child & Family Caring Society of Canada case.

Documents, produits ou révisés après Ie 26 janvier 2016, concernant la cause Société de soutien à I' enfance et à la famille des Premières Nations du Canada.",A-2016-00710,Department of Justice Canada | Ministère de la Justice Canada,2017-03,TRUE,TRUE,text,TRUE,TRUE
DOJ_A-2016-00719,atip-files/DOJ ATIPS/DOJ_A-2016-00719.pdf,"Audit, studies or reviews of any pension related activities, transactions and/or processes of the human resources area of the Department of Justice, January 2001, to August 8, 2016.

Vérification, études ou examens des activités, transactions et/ou processus en lien avec les pensions de la Direction des ressources humaines du ministère de la Justice, de janvier 2001 au 8 août 2016.",A-2016-00719,Department of Justice Canada | Ministère de la Justice Canada,2016-09,TRUE,TRUE,text,TRUE,TRUE
DOJ_A-2016-00722,atip-files/DOJ ATIPS/DOJ_A-2016-00722.pdf,"Complete copy of research led by Cheryl Webster related to these two contracts (4500128447) that seem to be the same.

Copie complète des recherches menées par Cheryl Webster en lien avec ces deux contrats (4500128447) qui semblent être les mêmes.",A-2016-00722,Department of Justice Canada | Ministère de la Justice Canada,2016-09,TRUE,TRUE,text,TRUE,TRUE
DOJ_A-2016-00745,atip-files/DOJ ATIPS/DOJ_A-2016-00745.pdf,"All ProServices contracts issued in the National Capital Region for the months of January, February and March .

Tous les contrats ProService attribués dans la région de la capitale nationale au cours des mois de janvier, février et mars.",A-2016-00745,Department of Justice Canada | Ministère de la Justice Canada,2016-08,TRUE,TRUE,text,TRUE,TRUE
DOJ_A-2016-00746,atip-files/DOJ ATIPS/DOJ_A-2016-00746.pdf,"All Task & Solutions Professional Services and Task Based Informatics Professional Services Supply Arrangement contracts and Standing Offer callups issued in the National Capital Region for the months of January, February and March 2016.

Tous les contrats attribués dans le cadre d’un arrangement en matière d’approvisionnement et commandes subséquentes à une offre à commandes en lien avec des services professionnels centrés sur les tâches et les solutions ainsi que des services professionnels en informatique centrés sur les tâches dans la région de la capitale nationale pour les mois de janvier, février et mars 2016.",A-2016-00746,Department of Justice Canada | Ministère de la Justice Canada,2016-08,TRUE,TRUE,text,TRUE,TRUE
DOJ_A-2016-00747,atip-files/DOJ ATIPS/DOJ_A-2016-00747.pdf,"All Temporary Help Services, Supply Arrangement, and Standing Offer callups issued in the National Capital Region for the months of January, February and March 2016.

Tous les arrangements en matière d’approvisionnement visant des services d’aide temporaire et l’utilisation des offres à commandes dans la région de la capitale nationale pour les mois de janvier, février et mars 2016.",A-2016-00747,Department of Justice Canada | Ministère de la Justice Canada,2016-08,TRUE,TRUE,text,TRUE,TRUE
DOJ_A-2016-00756,atip-files/DOJ ATIPS/DOJ_A-2016-00756.pdf,"Any decks, presentations, reports, or discussion papers prepared for the ADM level and above about the adoption and implementation on the UNDRIP; October 19, 2015 - August 11, 2016. Exclude portions that are obvious Cabinet Confidences.

L'ensemble des exposés, des présentations, des rapports ou des documents de discussion, préparés pour le SMA et pour les postes de niveau supérieur, concernant l'adoption et la mise en oeuvre de la DNUDPA, du 19 octobre 2015 au 11 août 2016. Exclure les documents qui sont manifestement des documents confidentiels du Cabinet.",A-2016-00756,Department of Justice Canada | Ministère de la Justice Canada,2016-11,TRUE,TRUE,text,TRUE,TRUE
DOJ_A-2016-00757,atip-files/DOJ ATIPS/DOJ_A-2016-00757.pdf,"Copies of THS contracts issued, under the standing offer and supply arrangement, between January 1, 2016, and June 30, 2016, for services provided under various streams / Sub streams.

Copie des marchés de SAT attribués dans le cadre d'offres à commandes et arrangements en matière d'approvisionnement entre le 1er janvier 2016 et le 30 juin 2016 pour des services rendus dans divers groupes et sous-groupes.",A-2016-00757,Department of Justice Canada | Ministère de la Justice Canada,2016-09,TRUE,TRUE,text,TRUE,TRUE
DOJ_A-2016-00773,atip-files/DOJ ATIPS/DOJ_A-2016-00773.pdf,"All THS Standing Offer No. EZ156-14000 call ups issued in the Western Region, October 2015 to March 2016.

Toutes les commandes subséquentes à l'offre de commandes No EZ156-14000 de SAT attribuées dans la région de l'Ouest d'octobre 2015 à mars 2016.",A-2016-00773,Department of Justice Canada | Ministère de la Justice Canada,2016-09,TRUE,TRUE,text,TRUE,TRUE
DOJ_A-2016-00790,atip-files/DOJ ATIPS/DOJ_A-2016-00790.pdf,"All documents that enable me to see the total amounts paid per year from the emergency fund to employees who had problems with their pay from the federal government; 2010-2016.

Tout document me permettant de voir les montants totaux par année provenant du fond d’urgence versés à des employés qui ont eu des problèmes de paye du gouvernement fédéral; 2010 - 2016.",A-2016-00790,Department of Justice Canada | Ministère de la Justice Canada,2016-08,TRUE,TRUE,text,TRUE,TRUE
DOJ_A-2016-00793,atip-files/DOJ ATIPS/DOJ_A-2016-00793.pdf,"List of all briefing materials prepared for the Minister and/or Deputy Minister of Justice from August 1 to 15, 2016. Exclude Cabinet Confidences.

Liste de tous les documents d'information préparés pour la ministre et/ou le sous-ministre de la Justice, du 1er au 15 août 2016. Exclure les documents confidentiels du Cabinet.",A-2016-00793,Department of Justice Canada | Ministère de la Justice Canada,2016-11,TRUE,TRUE,text,TRUE,TRUE
DOJ_A-2016-00795,atip-files/DOJ ATIPS/DOJ_A-2016-00795.pdf,"Please provide copies of the following briefing materials listed in A-2016-00219: BN 2016-004416; BN 2016-005144; BN 2016-005302; BN 2016-005693.

Documents d'information suivants mentionnés dans A-2016-00219 : notes d'information 2016-004416, 2016-005144, 2016-005302, 2016-005693.",A-2016-00795,Department of Justice Canada | Ministère de la Justice Canada,2016-12,TRUE,TRUE,text,TRUE,TRUE
DOJ_A-2016-00796,atip-files/DOJ ATIPS/DOJ_A-2016-00796.pdf,"Following briefing materials listed in A-2016-00219: 2016-006198; 2016-006632; 2016-006699; 2016-006876.

Documents d’information suivants mentionnés dans A-2016-00219 : 2016-006198; 2016-006632; 2016-006699; 2016-006876.",A-2016-00796,Department of Justice Canada | Ministère de la Justice Canada,2016-11,TRUE,TRUE,text,TRUE,TRUE
DOJ_A-2016-00797,atip-files/DOJ ATIPS/DOJ_A-2016-00797.pdf,"Following briefing materials listed in A-2016-00218: Memorandum 2016-003012; Briefing note 2016-004447, 2016-005829 and 2016-006252.

Documents d’information suivants mentionnés dans A-2016-00218 : Note 2016-003012; Notes d'information 2016-004447, 2016-005829 et 2016-006252.",A-2016-00797,Department of Justice Canada | Ministère de la Justice Canada,2016-11,TRUE,TRUE,text,TRUE,TRUE
DOJ_A-2016-00799,atip-files/DOJ ATIPS/DOJ_A-2016-00799.pdf,"Briefing materials listed in A-2016-00218: Briefing note 2016-004372, 2016-004476, 2016-004552, 2016-005109, and 2016-005239.

Documents d'information suivants qui figurent dans A-2016-00218 : notes d'information 2016-004372, 2016-004476, 2016-004552, 2016-005109, et 2016-005239.",A-2016-00799,Department of Justice Canada | Ministère de la Justice Canada,2017-01,TRUE,TRUE,text,TRUE,TRUE
DOJ_A-2016-00800,atip-files/DOJ ATIPS/DOJ_A-2016-00800.pdf,"Following briefing materials listed in A-2016-00219: Briefing note 2016-006912, 2016-007036, 2016-007251, 2016-007361, 2016-007512 and 2016-007648.

Documents d’information suivants mentionnés dans A-2016-00219 : Notes d'information 2016-006912, 2016-007036, 2016-007251, 2016-007361, 2016-007512 et 2016-007648.",A-2016-00800,Department of Justice Canada | Ministère de la Justice Canada,2016-11,TRUE,TRUE,text,TRUE,TRUE
DOJ_A-2016-00803,atip-files/DOJ ATIPS/DOJ_A-2016-00803.pdf,"Following briefing materials listed in A-2016-00218: Briefing note 2016-006130, 2016-006137, 2016-006465, Question Period Note 2016-006229; Briefing note 2016-006293 and Letter 2016-000667.

Documents d’information suivants mentionnés dans A-2016-00218: Notes d'information 2016-006130, 2016-006137, 2016-006465, Note pour la période de questions 2016-006229; Note d'information 2016-006293 et lettre 2016-000667.",A-2016-00803,Department of Justice Canada | Ministère de la Justice Canada,2016-11,TRUE,TRUE,text,TRUE,TRUE
DOJ_A-2016-00804,atip-files/DOJ ATIPS/DOJ_A-2016-00804.pdf,"Briefing materials listed in A-2016-00219: OTH 2016-008529; BN 2016-009364; BN 2016-006923; TP 2016-008296; BN 2016-006217.

Documents d'information suivants mentionnés dans A-2016-00219 : autres 2016-008529, notes d'information 2016-009364, 2016-006923 et 2016-006217, note d'allocution 2016-008296.",A-2016-00804,Department of Justice Canada | Ministère de la Justice Canada,2016-12,TRUE,TRUE,text,TRUE,TRUE
DOJ_A-2016-00805,atip-files/DOJ ATIPS/DOJ_A-2016-00805.pdf,"Briefing materials listed in A-2016-00219: Briefing Notes 2016-007257, 2016-007393, 2016-007741, 2016-007744 and 2016-009445.

Documents d’information suivants mentionnés dans A-2016-00219 : Notes d'information 2016-007257, 2016-007393, 2016-007741, 2016-007744 et 2016-009445.",A-2016-00805,Department of Justice Canada | Ministère de la Justice Canada,2016-11,TRUE,TRUE,text,TRUE,TRUE
DOJ_A-2016-00819,atip-files/DOJ ATIPS/DOJ_A-2016-00819.pdf,"March 2013 report (pasted below) in its entirety including Appendices. I believe this report was related to Aboriginal issues perhaps surrounding the Idle No More demonstrations in early 2013.

Rapport de mars 2013 (collé ci-dessous) dans son intégralité avec les annexes. Je crois que ce rapport concernait des enjeux touchant aux Autochtones possiblement en lien avec la manifestation de « Idle no more » tenue au début de 2013.",A-2016-00819,Department of Justice Canada | Ministère de la Justice Canada,2016-09,TRUE,TRUE,text,TRUE,TRUE
DOJ_A-2016-00831,atip-files/DOJ ATIPS/DOJ_A-2016-00831.pdf,"Public opinion polling conducted for the department since November 2015.

Sondage d'opinion publique effectué pour le ministère depuis novembre 2015.",A-2016-00831,Department of Justice Canada | Ministère de la Justice Canada,2016-09,TRUE,TRUE,text,TRUE,TRUE
DOJ_A-2016-00834,atip-files/DOJ ATIPS/DOJ_A-2016-00834.pdf,"All documents relating to Attawapiskat from April 10th, 2016 to August 26, 2016.

Tous les documents concernant Attawapiskat, du 10 avril 2016 au 26 août 2016.",A-2016-00834,Department of Justice Canada | Ministère de la Justice Canada,2016-11,TRUE,TRUE,text,TRUE,TRUE
DOJ_A-2016-00842,atip-files/DOJ ATIPS/DOJ_A-2016-00842.pdf,"All briefing notes, memoranda, legal opinions and other communication provided for the Justice Minister and issued by the Justice Department regarding the new process for appointing Supreme Court justices.

L'ensemble des notes d'information, des notes de service, des avis juridiques et toute autre communication fournie à la ministre de la Justice et émis par le ministère de la Justice au sujet du nouveau processus de nomination des juges de la Cour suprême",A-2016-00842,Department of Justice Canada | Ministère de la Justice Canada,2016-12,TRUE,TRUE,text,TRUE,TRUE
DOJ_A-2016-00859,atip-files/DOJ ATIPS/DOJ_A-2016-00859.pdf,"Each of the papers on the attached list. The list is from a previous ATIP request (From A-2016-00373 - List of briefing notes prepared for the DM for the period of March 1, 2016 to May 31, 2016. Exlcude potential Cabinet Confidences.).

Chacun des articles figurant sur la liste jointe. La liste vient d'une demande d'AIPRP précédente (de A-2016-00373 - Une liste de toutes les notes d'information préparées pour le SM pendant la période du 1er mars au 31 mai 2016. Exclure les documents potentiellement confidentiels du Cabinet.).",A-2016-00859,Department of Justice Canada | Ministère de la Justice Canada,2016-12,TRUE,TRUE,text,TRUE,TRUE
DOJ_A-2016-00860,atip-files/DOJ ATIPS/DOJ_A-2016-00860.pdf,"Briefing note 2016-010031' ""... DM Meeting to Discuss Immigration Enforcement…."".

Note d'information 2016-010031 […« Réunion du SM au sujet de l'éxécution des lois sur l'immigration [...] »",A-2016-00860,Department of Justice Canada | Ministère de la Justice Canada,2016-09,TRUE,TRUE,text,TRUE,TRUE
