identifier,file,description,title,creator,date,adaptive_ocr,better_pdf,mediatype,pinpoint,internet_archive
CBSA_A-2021-06487,atip-files/CBSA ATIPS/CBSA_A-2021-06487.pdf,"Records showing the new EC job descriptions including EC08, EC07, EC06, EC05, EC04, EC03, EC02 with the position numbers, that were created by classification officers and Human Resources employees from April 1, 2019 to March 31, 2021. This is for all the Canada Border Services Agency branches and pertains to the EC classification stream: statistical and survey methods and systems or related to qualitative and quantitative information positions. Additionally, records that explain the difference from one EC level to another and a high-level description that differentiates one level from another.

Documents montrant les nouvelles descriptions de travail du groupe EC, y compris les niveaux EC-08, EC-07, EC-06, EC-05, EC-04, EC-03 et EC-02, avec les numéros de poste, qui ont été créés par les agents de classification et les employés des ressources humaines du 1er avril 2019 au 31 mars 2021. Ceci s’applique à toutes les directions générales de l’Agence des services frontaliers du Canada et concerne le volet de classification EC, soit les méthodes et systèmes statistiques et d’enquête ou liés aux postes relatifs aux renseignements qualitatifs et quantitatifs. De plus, les documents qui expliquent la différence d'un niveau EC à un autre et une description générale qui permet de différencier un niveau d’un autre.",A-2021-06487,Canada Border Services Agency | Agence des services frontaliers du Canada,2021-08,TRUE,TRUE,text,TRUE,TRUE
CBSA_A-2021-06532,atip-files/CBSA ATIPS/CBSA_A-2021-06532.pdf,"Statistic from April 1, 2014 to March 31, 2020, on the total number of days spent in custody by people who were detained for over a year by the Canada Border Services Agency.

Statistiques du 1er avril 2014 au 31 mars 2020, sur le nombre total de jours passés en détention par les personnes qui ont été détenues pendant plus d’un an par l’Agence des services frontaliers du Canada.",A-2021-06532,Canada Border Services Agency | Agence des services frontaliers du Canada,2021-05,TRUE,TRUE,text,TRUE,TRUE
CBSA_A-2021-06599,atip-files/CBSA ATIPS/CBSA_A-2021-06599.xlsx,"Statistics on all vehicles that were exported out of Canada from March 1 to 31, 2021. Broken down by the following data fields: vehicle identification number, goods description, carrier name, date of exportation, country of final destination code, export report office, and quantity.

Statistiques sur tous les véhicules qui ont été exportés du Canada du 1er au 31 mars 2021. Ventilées selon les champs de données suivants : numéro d’identification du véhicule, description des marchandises, nom du transporteur, date d’exportation, code du pays de destination, bureau de déclaration des exportations et quantité.",A-2021-06599,Canada Border Services Agency | Agence des services frontaliers du Canada,2021-04,TRUE,TRUE,data,TRUE,TRUE
CBSA_A-2021-06871,atip-files/CBSA ATIPS/CBSA_A-2021-06871.pdf,"Statistics from January 1, 2011 to January 31, 2021, broken down by country of origin for the total number of: inadmissibility reports issued by the Canada Border Services Agency (CBSA) on security grounds; and inadmissibility reports issued by the CBSA on security grounds against foreign nationals or persons concerned originating from the following countries: Bangladesh, Pakistan, Egypt, Turkey, Somalia, Yemen, Nigeria, and Afghanistan. Additionally, the total number of inadmissibility reports issued by the CBSA against foreign nationals or persons concerned on security grounds and the total number of person removed who were member of the following organizations: Bangladesh Nationalist Party, Jamat e Islami or Jamaat or Jamaat Islami, Muslim Brotherhood, Freedom and Justice Party. Further, for the previously listed organizations the number of members who were found to be removal ready or on a list of persons to be removed from Canada.

Statistiques du 1er janvier 2011 au 31 janvier 2021, ventilées par pays d’origine pour le nombre total de : rapports d’interdiction de territoire établis par l’Agence des services frontaliers du Canada (ASFC) pour des motifs de sécurité et rapports d’interdiction de territoire établis par l’ASFC pour des motifs de sécurité contre des étrangers ou des personnes visées originaires des pays suivants : Bangladesh, Pakistan, Égypte, Turquie, Somalie, Yémen, Nigeria et Afghanistan. De plus, le nombre total de rapports d’interdiction de territoire établis par l’ASFC contre des étrangers ou des personnes visées pour des raisons de sécurité et le nombre total de personnes renvoyées qui étaient membres des organisations suivantes : Parti nationaliste du Bangladesh, Jamat e Islami ou Jamaat ou Jamaat Islami, Frères musulmans, Parti de la liberté et de la justice. En outre, pour les organisations énumérées précédemment, le nombre de membres qui ont été jugés prêts à être renvoyés ou figurant sur une liste de personnes à renvoyer du Canada.",A-2021-06871,Canada Border Services Agency | Agence des services frontaliers du Canada,2021-05,TRUE,TRUE,text,TRUE,TRUE
CBSA_A-2021-06875,atip-files/CBSA ATIPS/CBSA_A-2021-06875.pdf,"Records from January 1, 2007 to December 31, 2020, including files, reports, presentations, recommendations, communications, consultations, decisions, and requests for proposals pertaining to the Canada Border Services Agency’s procedure for selection, approval, adoption, acquisition, deployment, user-qualification-metrics, initial and follow-up training requirements, issuance, usage, and storage of: semi-automatic .223 / 5.56 mm firearm and semi-automatic .308 / 7.62 mm firearms.

Documents du 1er janvier 2007 au 31 décembre 2020, y compris les dossiers, les rapports, les présentations, les recommandations, les communications, les consultations, les décisions et les demandes de propositions concernant la procédure de l'Agence des services frontaliers du Canada pour la sélection, l'approbation, l'adoption, l'acquisition, le déploiement, les paramètres de qualification des utilisateurs, les exigences de formation initiale et de suivi, la délivrance, l'utilisation et l'entreposage des armes à feu semi-automatiques de calibre .223/5,56 mm et des armes à feu semi-automatiques de calibre .308/7,62 mm.",A-2021-06875,Canada Border Services Agency | Agence des services frontaliers du Canada,2021-12,TRUE,TRUE,text,TRUE,TRUE
CBSA_A-2021-06897,atip-files/CBSA ATIPS/CBSA_A-2021-06897.pdf,"Statistics from January 1, 2007 to December 31, 2020, involving: shooting or firearm discharge by officers of the Canada Border Services Agency (CBSA), broken down by: number of incidents per year, name of employee involved, caliber of weapon, and type of weapon. Additionally, annual statistics concerning the number shooting incidents involving officers of the CBSA including: the number of times each type of weapon was used, the number of shots discharged by each type of weapon, the number of shots per weapon discharged that missed the target, and the number of CBSA officers who discharged weapons by accident.

Statistiques du 1er janvier 2007 au 31 décembre 2020 sur le tir ou la décharge d'une arme à feu par des agents de l'Agence des services frontaliers du Canada (ASFC), réparties par : nombre d'incidents par année, nom de l'employé concerné, calibre de l'arme et type d'arme. Aussi, statistiques annuelles sur le nombre d'incidents de tir par des agents de l'ASFC, notamment : nombre de fois que chaque type d'arme a été utilisée, nombre de coups tirés par chaque type d'arme, nombre de coups tirés ayant raté la cible et nombre d'agents de l'ASFC ayant déchargé une arme accidentellement.",A-2021-06897,Canada Border Services Agency | Agence des services frontaliers du Canada,2021-06,TRUE,TRUE,text,TRUE,TRUE
CBSA_A-2021-07619,atip-files/CBSA ATIPS/CBSA_A-2021-07619.pdf,"A list as of April 14, 2021, of employees of the Canada Border Services Agency working at the Windsor Tunnel and the Ambassador Bridge at the FB-05 and FB-07 level. Broken down by the employees: rank, job title, continuous service date, date leave without pay began, most recent prior work location, and position classification.

Liste des employés de l'Agence des services frontaliers du Canada occupant un poste du groupe FB-05 et FB-07 qui travaillaient au tunnel Windsor et au pont Ambassador en date du 14 avril 2021, indiquant le rang, le titre du poste, la date de début du service ininterrompu, la date de début du congé sans solde, le dernier emploi antérieur et la classification du poste de chaque employé.",A-2021-07619,Canada Border Services Agency | Agence des services frontaliers du Canada,2021-06,TRUE,TRUE,text,TRUE,TRUE
CBSA_A-2021-07636,atip-files/CBSA ATIPS/CBSA_A-2021-07636.xlsx,"Statistics as of April, 12, 2021, concerning positions at the Directorate of International Policy and Partnerships and Directorate of Law Enforcement and Intelligence. Broken down by the following for each position: the position number; classification; position title; appointment process used, both for advertised or non-advertised process; date of entry into position or if it is vacant; the duration of the appointment, if it was an assignment, secondment, determined, indeterminate, Interim, or a transfer; the language requirement of the position; the current linguistic profile of the employee occupying the position, and whether they meet the language requirements of the position.

Statistiques en date du 12 avril 2021 concernant les postes à la Direction des politiques internationales et des partenariats et à la Direction des programmes d’exécution de la loi et du renseignement. Pour chaque poste, le numéro du poste, la classification, le titre du poste, le processus de nomination utilisé, qu'il s’agisse d’un processus annoncé ou non annoncé, la date d’entrée en fonction ou s’il s’agit d’un poste vacant, la durée de la nomination, s’il s’agit d’une affectation, d'un détachement, d'une nomination pour une période déterminée, d'une nomination pour une période indéterminée, d'une nomination intérimaire ou d'une mutation; les exigences linguistiques du poste; le profil linguistique actuel de l’employé qui occupe le poste et s’il satisfait aux exigences linguistiques du poste.",A-2021-07636,Canada Border Services Agency | Agence des services frontaliers du Canada,2021-08,TRUE,TRUE,data,TRUE,TRUE
CBSA_A-2021-07671,atip-files/CBSA ATIPS/CBSA_A-2021-07671.pdf,"Records setting out the current duties and responsibilities for a Superintendent at the Ambassador Bridge assigned to: the Onsite, the Offsite, the Operational Control Centre, Traffic, Immigration, the Electronic Gate, and Detroit. Additionally, the current duties and responsibilities of Superintendent at the Windsor Tunnel assigned to: Traffic, Immigration, and Administrative duties.

Dossiers indiquant les tâches et les responsabilités actuelles d'un surintendant au pont Ambassador affecté sur le site, hors site, au Centre de contrôle des opérations, à la circulation, à l'immigration, à la porte électronique et à Detroit. Aussi, les tâches et responsabilités actuelles d'un surintendant au tunnel Windsor affecté à la circulation, à l'immigration et à des tâches administratives.",A-2021-07671,Canada Border Services Agency | Agence des services frontaliers du Canada,2021-06,TRUE,TRUE,text,TRUE,TRUE
CBSA_A-2021-07826,atip-files/CBSA ATIPS/CBSA_A-2021-07826.pdf,"Records of the Canada Border Services Agency Enforcement Manual (ENF) Part 3, Chapter 6, Surveillance. Additionally, records that authorized the website technician to remove Section 14 - Procedures for Places of Worship from ENF 10 during the update that took place on or about February 24, 2017, and records of correspondence and records from January 1, 2010 to April 30, 2017, including emails, briefing notes, internal memoranda, directives, and guidelines relating to the removal of this section. Additionally, records of email dated October 30, 2014, with the subject line Outline for ENF 10 from Richard A. Dvorski to Richard St Marseille, and Nathan Dempster. This is limited to electronic records and excludes records requiring consultations with the Privy Council Office or the Department of Justice.

Dossiers du chapitre 6, Surveillance, de la partie 3 du Manuel de l’exécution (ENF) de l’Agence des services frontaliers du Canada. De plus, les dossiers qui ont autorisé le technicien du site Web à renvoyer la section 14, Procédures à suivre dans les cas de refuge dans des lieux de culte, d’ENF 10 lors de la mise à jour qui a eu lieu le ou vers le 24 février 2017 ainsi que les dossiers de correspondance et les dossiers du 1er janvier 2010 au 30 avril 2017, y compris les courriels, les notes d’information, les notes de service internes, les directives et les lignes directrices liés au renvoi de cette section. De plus, des dossiers de courriels en date du 30 octobre 2014, avec la ligne d’objet « Outline for ENF 10 » de Richard A. Dvorski à Richard St Marseille et Nathan Dempster. Cela ne comprend que les documents électroniques et exclut les documents nécessitant des consultations avec le Bureau du Conseil privé ou le ministère de la Justice.",A-2021-07826,Canada Border Services Agency | Agence des services frontaliers du Canada,2022-02,TRUE,TRUE,text,TRUE,TRUE
CBSA_A-2021-08139,atip-files/CBSA ATIPS/CBSA_A-2021-08139.pdf,"Records showing nationalities of passengers who came to Canada on October 16, 2018, through Pierre Elliott Trudeau International Airport in Montreal.

Documents précisant les nationalités des passagers qui sont arrivés au Canada le 16 octobre 2018 par l’aéroport international Pierre-Elliott-Trudeau de Montréal.",A-2021-08139,Canada Border Services Agency | Agence des services frontaliers du Canada,2021-05,TRUE,TRUE,text,TRUE,TRUE
CBSA_A-2021-08617,atip-files/CBSA ATIPS/CBSA_A-2021-08617.pdf,"Records of the Canada Border Services Agency (CBSA) internal policy, available on the CBSA intranet, entitled: Policy on Internal Investigations into Alleged or Suspected Employee Misconduct.

Documents de la politique interne de l’Agence des services frontaliers du Canada (ASFC), disponible sur l’intranet de l’ASFC, intitulée : Politique sur les enquêtes internes sur l’inconduite présumée ou soupçonnée d’un employé.",A-2021-08617,Canada Border Services Agency | Agence des services frontaliers du Canada,2021-05,TRUE,TRUE,text,TRUE,TRUE
CBSA_A-2021-08698,atip-files/CBSA ATIPS/CBSA_A-2021-08698.pdf,"Records of the Pedestrian Walk Security Assessment for the Rainbow Bridge Port of Entry at Niagara Falls, Ontario, Canada.

Dossiers de l’évaluation de la sécurité de la voie piétonne pour le point d’entrée du pont Rainbow à Niagara Falls, en Ontario, au Canada.",A-2021-08698,Canada Border Services Agency | Agence des services frontaliers du Canada,2021-07,TRUE,TRUE,text,TRUE,TRUE
CBSA_A-2021-08747,atip-files/CBSA ATIPS/CBSA_A-2021-08747.pdf,"Statistics from January 1, 2019 to February 28, 2021, for the Ambassador Bridge, Blue Water Bridge, Peace Bridge, and Queenston Lewiston Bridge, listing on a monthly basis how many FB employees existed at each crossing and how many were on 699 leave, broken down by port of entry. This is restricted to electronic records.

Statistiques du 1er janvier 2019 au 28 février 2021 pour le pont Ambassador, le pont Blue Water, le pont Peace et le pont Queenston-Lewiston, qui énumèrent mensuellement le nombre d’employés FB à chaque passage et le nombre d’employés en congé de code 699, ventilé par point d’entrée. Cela ne comprend que les documents électroniques.",A-2021-08747,Canada Border Services Agency | Agence des services frontaliers du Canada,2022-02,TRUE,TRUE,text,TRUE,TRUE
CBSA_A-2021-08752,atip-files/CBSA ATIPS/CBSA_A-2021-08752.pdf,"Electronic records from January 1, 2020 to January 31, 2021, pertaining to the creation of 3 superintendent positions at the Ambassador Bridge. This includes emails between Director Joe McMahon and Regional Director General Christine Durocher and all other email to or from Joe McMahon discussing this issue.

Documents électroniques, datés entre le 1er janvier 2020 et le 31 janvier 2021, concernant la création de trois postes de surintendants au pont Ambassador; notamment, les courriels entre le directeur Joe McMahon et la directrice régionale Christine Durocher, ainsi que tout autre courriel que Joe McMahon a envoyé ou reçu à ce sujet.",A-2021-08752,Canada Border Services Agency | Agence des services frontaliers du Canada,2020-11,TRUE,TRUE,text,TRUE,TRUE
CBSA_A-2021-08760,atip-files/CBSA ATIPS/CBSA_A-2021-08760.pdf,"Electronic records involving the selection decisions for the following persons: Warren Bekker, Michael Cole, Anthony Cortese, Tiara Coughlin, Justin Coulas, Alana DiMarco, Ian Falzon, Jasmina Dugonjic, Melanie Iannitelli, Ayesha Khan, Avinash Maharaj, Catherine Mann, Stephanie Moniz, Elizabeth Pardo Getmanets, Santy Restrepo, Norman Ryan, Anam Sabah, Jason Turner, Denise Weindl-Sidor, Eleftheria Vardalos, Steve Wong, McNamara Karen, Dunbar Chris, Sébastien Lalonde Miller, Muneer Barday, Christopher D'Angelo, and Marcel Rigatti. This excludes any identifying personal information.

Documents électroniques qui font état des décisions de sélection concernant les personnes suivantes : Warren Bekker, Michael Cole, Anthony Cortese, Tiara Coughlin, Justin Coulas, Alana DiMarco, Ian Falzon, Jasmina Dugonjic, Melanie Iannitelli, Ayesha Khan, Avinash Maharaj, Catherine Mann, Stephanie Moniz, Elizabeth Pardo Getmanets, Santy Restrepo, Norman Ryan, Anam Sabah, Jason Turner, Denise Weindl-Sidor, Eleftheria Vardalos, Steve Wong, McNamara Karen, Dunbar Chris, Sébastien Lalonde Miller, Muneer Barday, Christopher D'Angelo et Marcel Rigatti. Ne pas inclure de renseignements personnels permettant d’identifier ces personnes.",A-2021-08760,Canada Border Services Agency | Agence des services frontaliers du Canada,2020-11,TRUE,TRUE,text,TRUE,TRUE
CBSA_A-2021-08770,atip-files/CBSA ATIPS/CBSA_A-2021-08770.pdf,"Statistics from January 1, 2017 to April 27, 2021 on the number of foreign nationals broken down by month and by country, who have entered Canada under a study permit or have applied for a study permit at the border, or a temporary visitor visa, or an electronic travel authorization.

Statistiques du 1er janvier 2017 au 27 avril 2021 sur le nombre d’étrangers, ventilées par mois et par pays, qui sont entrés au Canada en vertu d’un permis d’études ou ont demandé un permis d’études à la frontière, ou un visa de visiteur temporaire, ou une autorisation de voyage électronique.",A-2021-08770,Canada Border Services Agency | Agence des services frontaliers du Canada,2021-07,TRUE,TRUE,text,TRUE,TRUE
CBSA_A-2021-08774,atip-files/CBSA ATIPS/CBSA_A-2021-08774.pdf,"Electronic records concerning the articulation of the selection decision for the following persons: Paul Boakye-Cofie, Todd Hoover, Andrew Ratte. This excludes any personal information.

Documents électroniques concernant l'explication de la décision de sélection des personnes suivantes : Paul Boakye-Cofie, Todd Hoover, Andrew Ratte. Cela exclut les renseignements personnels.",A-2021-08774,Canada Border Services Agency | Agence des services frontaliers du Canada,2021-05,TRUE,TRUE,text,TRUE,TRUE
CBSA_A-2021-08799,atip-files/CBSA ATIPS/CBSA_A-2021-08799.pdf,"Statistics from March 21 to December 21, 2020, on the number of people who attempted to enter Canada from the United States in order to make a refugee claim, but were denied under subsection 5 (1) of the order entitled: Order to reduce the risk of exposure to COVID-19 in Canada, broken down by month and by age of the claimant. Additionally, the number of persons exempted from the prohibition under subsection 5 (2), broken down by month and the age of the claimant.

Statistiques du 21 mars au 21 décembre 2020 sur le nombre de personnes qui ont tenté d’entrer au Canada en provenance des États-Unis afin de présenter une demande d'asile, mais qui ont été déboutées en vertu du paragraphe 5(1) du décret intitulé : Décret visant la réduction du risque d’exposition à la COVID-19 au Canada, ventilées par mois et par âge du demandeur. En outre, le nombre de personnes exemptées de l’interdiction en vertu du paragraphe 5(2), ventilé par mois et par âge du demandeur.",A-2021-08799,Canada Border Services Agency | Agence des services frontaliers du Canada,2021-05,TRUE,TRUE,text,TRUE,TRUE
CBSA_A-2021-08800,atip-files/CBSA ATIPS/CBSA_A-2021-08800.pdf,"Statistics from January 2 to 10, 2021, on the number of travelers arriving in Canada by plane from the Dominican Republic. This excludes names and personal information.

Statistiques du 2 au 10 janvier 2021 sur le nombre de voyageurs arrivant au Canada par avion en provenance de la République dominicaine. Cela exclut les noms et les renseignements personnels.",A-2021-08800,Canada Border Services Agency | Agence des services frontaliers du Canada,2021-05,TRUE,TRUE,text,TRUE,TRUE
CBSA_A-2021-08868,atip-files/CBSA ATIPS/CBSA_A-2021-08868.pdf,"Records from January 1, 2019 to March 31, 2021, of the quarterly dashboards for each sector, branch, and region with information on recruitment, promotions and departures as per the Canada Border Services Agency Employment Equity and Diversity Action Plan 2016-2019. Additionally, the employment equity plan developed by the Southern Ontario Region to meet objectives and reduce employment equity shortfalls.

Dossiers du 1er janvier 2019 au 31 mars 2021 des tableaux de bord trimestriels pour chaque secteur, direction générale et région avec des renseignements sur le recrutement, les promotions et les départs, conformément au Plan d’action sur l’équité en matière d’emploi et la diversité 2016-2019 de l’Agence des services frontaliers du Canada. De plus, le plan d’équité en matière d’emploi élaboré par la région du Sud de l’Ontario pour atteindre les objectifs et atténuer l’insuffisance d’équité en matière d’emploi.",A-2021-08868,Canada Border Services Agency | Agence des services frontaliers du Canada,2022-02,TRUE,TRUE,text,TRUE,TRUE
CBSA_A-2021-08918,atip-files/CBSA ATIPS/CBSA_A-2021-08918.pdf,"Statistics from April 1 to 30, 2021, for all vehicles that were exported out of Canada listing the following data fields: vehicle identification number, goods description, carrier name, date of export, country of final destination code, export report office, and quantity.

Statistiques sur tous les véhicules qui ont été exportés du Canada entre le 1er et le 30 avril 2021, réparties dans les champs de données suivants : numéro d'identification du véhicule, description des marchandises, nom du transporteur, date de l'exportation, code du pays de destination finale, bureau responsable du rapport d'exportation et quantité.",A-2021-08918,Canada Border Services Agency | Agence des services frontaliers du Canada,2021-06,TRUE,TRUE,text,TRUE,TRUE
CBSA_A-2021-08918,atip-files/CBSA ATIPS/CBSA_A-2021-08918.xlsx,"Statistics from April 1 to 30, 2021, for all vehicles that were exported out of Canada listing the following data fields: vehicle identification number, goods description, carrier name, date of export, country of final destination code, export report office, and quantity.

Statistiques sur tous les véhicules qui ont été exportés du Canada entre le 1er et le 30 avril 2021, réparties dans les champs de données suivants : numéro d'identification du véhicule, description des marchandises, nom du transporteur, date de l'exportation, code du pays de destination finale, bureau responsable du rapport d'exportation et quantité.",A-2021-08918,Canada Border Services Agency | Agence des services frontaliers du Canada,2021-06,TRUE,TRUE,data,TRUE,TRUE
CBSA_A-2021-09144,atip-files/CBSA ATIPS/CBSA_A-2021-09144.pdf,"Records from January 1, 2019 to May 3, 2021 of all misconducts, disciplinary actions or decisions, rendered or reported from all areas in the Greater Toronto Area region. This excludes any names or identifying numbers.

Dossiers du 1er janvier 2019 au 3 mai 2021 de toutes les inconduites, mesures disciplinaires ou décisions, rendues ou signalées dans tous les secteurs de la région du Grand Toronto. Cela exclut tout nom ou numéro d’identification.",A-2021-09144,Canada Border Services Agency | Agence des services frontaliers du Canada,2021-07,TRUE,TRUE,text,TRUE,TRUE
CBSA_A-2021-09651,atip-files/CBSA ATIPS/CBSA_A-2021-09651.pdf,"Electronic records from January 1 to 31, 2021, belonging to the Human Resources Programs Directorate involving three new FB-05 position that were approved for creation at the Ambassador Bridge by National Organization and Classification, specifically positions numbers: 30377788, 30377789, and 30377790. This includes the documents the directive on Classification B.2.2.9 lists that must be on file when a classification decision is made.

Documents électroniques de la Direction des programmes des ressources humaines, datés du 1er au 31 janvier 2021, concernant trois nouveaux postes de niveau FB-05 au pont Ambassador dont la création a été approuvée par la Division nationale de l'organisation et de la classification, plus précisément les postes no 30377788, no 30377789 et no 30377790; notamment, les documents requis au dossier pour prendre une décision de classification, énumérés dans la Directive sur la classification (B.2.2.9).",A-2021-09651,Canada Border Services Agency | Agence des services frontaliers du Canada,2020-11,TRUE,TRUE,text,TRUE,TRUE
