identifier,file,description,title,creator,date,adaptive_ocr,better_pdf,mediatype,pinpoint,internet_archive
CBSA_A-2014-14403,atip-files/CBSA ATIPS/CBSA_A-2014-14403.pdf,"Records from June 1, 2014 to November 30, 2014 from the National Border Operations Centre's Targeting Operations - Intelligence section regarding: scenario based training, exchange programme with the Royal Canadian Mounted Police, high risk travellers, Syrian and other foreign fighters, confronting terrorist travel, and a Ministerial briefing on traveling sex offenders.

Dossiers du 1er juin 2014 au 30 novembre 2014 des Opérations de ciblage du Centre national des opérations frontalières — Section du renseignement, concernant : les formations fondées sur des scénarios, le programme de communication avec la Gendarmerie royale du Canada, les voyageurs à haut risque, les combattants syriens et autres combattants étrangers, la lutte contre les voyages de terroristes et un exposé ministériel sur les déplacements à l'étranger des délinquants sexuels.",A-2014-14403,Canada Border Services Agency | Agence des services frontaliers du Canada,2017-03,TRUE,TRUE,text,TRUE,TRUE
CBSA_A-2015-06212,atip-files/CBSA ATIPS/CBSA_A-2015-06212.pdf,"Records from December 31, 2005 to April 7, 2015 related to investigations into, and applications for, cessation of refugee protection under the Immigration and Refugee Protection Act, section 108. This includes: operational and policy discussions; policies, directives, and memoranda; meetings and communications; email headers; training materials; profiles of individuals to be investigated; and the costs of cessation investigations, units, interventions and appeals.

Dossiers du 31 décembre 2005 au 7 avril 2015 d’enquête ou de demande concernant la perte de l’asile aux termes de l’article 108 de la Loi sur l’immigration et la protection des réfugiés. Ces dossiers peuvent comprendre ce qui suit : discussions stratégiques et opérationnelles; politiques, directives et notes de service; réunions et communications; objets de courriels; documents de formation; profils des personnes devant faire l’objet d’une enquête; coûts des enquêtes sur la perte d’asile, des unités, des interventions et des appels.",A-2015-06212,Canada Border Services Agency | Agence des services frontaliers du Canada,2019-12,TRUE,TRUE,text,TRUE,TRUE
CBSA_A-2015-15846,atip-files/CBSA ATIPS/CBSA_A-2015-15846.pdf,"Statistics from October 29, 2010 to October 29, 2015 relating to non-citizen minors present in an immigration holding centre for 24 hours or more either detained: under the Immigration and Refugee Protection Act, or as guests, or accompanying their non-citizen relative or guardian. Statistics are broken down by the number and percentage detained between: 24 hours to 1 week, 1 to 4 weeks, 4 to 12 weeks, 12 weeks to 6 months, 6 months to 1 year, and over 1 year.

Statistiques du 29 octobre 2010 au 29 octobre 2015 sur les mineurs non citoyens se trouvant dans un Centre de surveillance de l’immigration, pour 24 heures ou plus, détenus en vertu de la Loi sur la protection des réfugiés ou parce qu’ils accompagnent un parent ou un tuteur non citoyen. Les statistiques sont présentées en fonction du nombre et du pourcentage de mineurs détenus : de 24 heures à 1 semaine, de 1 semaine à 4 semaines, de 4 semaines à 12 semaines, de 12 semaines à 6 mois, de 6 mois à 1 an, et plus de 1 an.",A-2015-15846,Canada Border Services Agency | Agence des services frontaliers du Canada,2018-05,TRUE,TRUE,text,TRUE,TRUE
CBSA_A-2016-00487,atip-files/CBSA ATIPS/CBSA_A-2016-00487.pdf,"Policy documents concerning security screening at the Canada Border Services Agency (CBSA), including those related to the High Integrity Personnel Security Screening Standard, as well as the interview guide relating to this process. Additionally correspondence between the CBSA and the Privacy Commissioner of Canada in relation to the Privacy Impact Assessment submitted by the CBSA on February 3, 2014.

Les documents de politique concernant le filtrage de sécurité à l’Agence des services frontaliers du Canada (ASFC), y compris ceux qui concernent la norme d’intégrité élevée en matière d’enquêtes de sécurité sur le personnel ainsi que le guide des entrevues relatif à cette procédure. De plus, la correspondance entre l’ASFC et le commissaire à la protection de la vie privée du Canada au sujet de l’évaluation des facteurs relatifs à la vie privée déposée par l’ASFC le 3 février 2014.",A-2016-00487,Canada Border Services Agency | Agence des services frontaliers du Canada,2020-02,TRUE,TRUE,text,TRUE,TRUE
CBSA_A-2016-04061,atip-files/CBSA ATIPS/CBSA_A-2016-04061.pdf,"Reports as of March 23, 2016 regarding the lessons learned after each of the eleven in-custody deaths, two in federal holding centres and nine in provincial facilities.

Rapports du 23 mars 2016 sur les leçons tirées de onze décès en établissement : deux dans des centres de surveillance fédéraux et neuf dans des établissements provinciaux.",A-2016-04061,Canada Border Services Agency | Agence des services frontaliers du Canada,2019-12,TRUE,TRUE,text,TRUE,TRUE
CBSA_A-2016-07019,atip-files/CBSA ATIPS/CBSA_A-2016-07019.pdf,"Briefing Notes and Memorandums from January 1 to May 1, 2016, prepared for the Minister of Public Safety and Emergency Preparedness.

Notes d’information et notes de service du 1er janvier au 1er mai 2016, rédigées pour le ministre de la Sécurité publique et de la Protection civile.",A-2016-07019,Canada Border Services Agency | Agence des services frontaliers du Canada,2020-06,TRUE,TRUE,text,TRUE,TRUE
CBSA_A-2016-07028,atip-files/CBSA ATIPS/CBSA_A-2016-07028.pdf,"The following Briefing Notes: 16-00504 - Briefing material for the visit by Commissioner Quaedvlieg (Australian Border Force) to the Canada Border Services Agency; 16-00593 - Information Memorandum to the Vice President, Programs Engagement with China; 16-00697 - Memorandum of Understanding between the Canada Border Services Agency and the Correctional Service of Canada; 16-00859 - Material for the February 25, 2016 Meeting on Information Sharing; 16-00895 - Minister’s Hot Issue Notes; 16-00960 - Deputy Minister's National Security Committee.

Les notes d’information suivantes : 16-00504 - Documents d’information pour la visite du commissaire Quaedvlieg (Force Frontaliaire Australienne) à l'Agence des services frontaliers du Canada; 16-00593 - Note d’information au vice-président, Mobilisation des programmes avec la Chine; 16-00697 - Protocole d’entente entre l’Agence des services frontaliers du Canada et le Service correctionnel du Canada; 16-00859 - Documents pour la réunion du 25 février 2016 sur l’échange d’information; 16-00895 - Notes d’information du ministre sur les questions délicates; 16-00960 - Comité des sous-ministres sur la sécurité nationale.",A-2016-07028,Canada Border Services Agency | Agence des services frontaliers du Canada,2020-01,TRUE,TRUE,text,TRUE,TRUE
CBSA_A-2016-07040,atip-files/CBSA ATIPS/CBSA_A-2016-07040.pdf,"The following Briefing Notes prepared from December 10, 2015 to February 14, 2016, for the Minster of Public Safety and Emergency Preparedness and the President of the Canada Border Services Agency (CBSA) entitled: Update on the CBSA’s Mutual Recognition Arrangements regarding Authorized Economic Programs; Border Security: Canada's Front Line, File Created in Error; Decision on the CBSA's participation in a documentary series at the Edmonton International Airport; Request for Canadian Armed Forces Assistance for Irregular Marine Arrivals; Minister's Briefing Package for the Criminal Investigations (E); National Criminal Investigations Workshop; Memorandum of Understanding between Immigration, Refugees and Citizenship Canada, the CBSA, and the Immigration and Refugee Board; Stay Removal Order; National Inquiry on Missing and Murdered Indigenous Women and Girls; Shared Services Canada Aging Infrastructure Letter and Briefing Note; Close Name Matches in the CBSA Systems; Border Controls for Certain Supply-Managed Agricultural Goods; Dairy Farmers of Canada - The Duty Deferral Program and Diafiltered Milk; MINO Tasking - Detention; Proposed Regulatory Amendments Introducing an Application Process for Ministerial Relief and Clarifying the End of Examination for Refugee Claimants; the CBSA and the Correctional Service of Canada Memorandum of Understanding.

Les notes d’information suivantes ont été préparées entre le 10 décembre 2015 et le 14 février 2016 pour le ministre de la Sécurité et de la Protection civile et pour le président de l’Agence des services frontaliers du Canada (ASFC) et sont intitulées : Mise à jour aux ententes de reconnaissance mutuelles de l’ASFC en ce qui a trait aux programmes économiques autorisés; Border Security: Canada’s Front Line, Document créé par erreur; Décision sur la participation de l’ASFC à une série documentaire à l’aéroport international d’Edmonton; Demande d’assistance des Forces canadiennes pour des arrivées irrégulières par voie maritime; Documentation du ministre pour les Enquêtes criminelles (EC); Atelier des enquêtes criminelles nationales; Protocole d’entente entre Immigration, réfugiées et citoyenneté Canada, l’ASFC et la Commission de l’immigration et du statut de réfugié; Sursis des mesures de renvoi; Enquête nationale sur les femmes et les filles autochtones disparues et assassinées; Lettre et notes d’information de Services partagés Canada sur les infrastructures vieillissantes; Quasi-concordances des noms dans les systèmes de l’ASFC; Contrôles frontaliers pour certains produits agricoles assujettis à la gestion de l’offre; Producteurs laitiers du Canada – Le programme de report des droits et le lait diafiltré; Attribution de tâches par le Cabinet du ministre – Détention; Modifications réglementaires proposées pour l’adoption d’un processus de demande de dispense ministérielle et pour la clarification de la fin de l’examen pour les demandeurs d’asile; Protocole d’entente entre l’ASFC et le Service correctionnel du Canada.",A-2016-07040,Canada Border Services Agency | Agence des services frontaliers du Canada,2020-04,TRUE,TRUE,text,TRUE,TRUE
CBSA_A-2016-07092,atip-files/CBSA ATIPS/CBSA_A-2016-07092.pdf,"Records as of May 26, 2016, including but not limited to briefing materials, emailed correspondence and PowerPoint presentations, concerning the Canada Border Services Agency’s policy on electronic tracking of immigration detainees as an alternative to detention.

Documentation en date du 26 mai 2016, y compris les documents d’information, la correspondance par courriel et les présentations PowerPoint, concernant la politique de l’Agence des services frontaliers du Canada sur le suivi électronique des personnes détenues à des fins d’immigration comme solution de rechange à la détention.",A-2016-07092,Canada Border Services Agency | Agence des services frontaliers du Canada,2020-03,TRUE,TRUE,text,TRUE,TRUE
CBSA_A-2016-07574,atip-files/CBSA ATIPS/CBSA_A-2016-07574.pdf,"Final versions of documents prepared from January 1, 2015 to December 31, 2016 for the Minister of Public Safety and Emergency Preparedness and the President of the Canada Border Services Agency (CBSA) regarding: greater oversight of CBSA operations; the CBSA risk assessment centre; cooperation with the Royal Canadian Mounted Police, the Canadian Security Intelligence Service and the Communications Security Establishment; cross border information sharing arrangements and the privacy implications they pose.

Versions définitives de documents établis entre le 1erjanvier 2015 et le 31 décembre 2016 pour le ministre de la Sécurité publique et de la Protection civile et le président de l’Agence des services frontaliers du Canada (ASFC) concernant : la surveillance accrue des activités de l’ASFC; le Centre d’évaluation des risques de l’ASFC; la collaboration avec la Gendarmerie royale du Canada, le Service canadien du renseignement de sécurité et le Centre de la sécurité des télécommunications; les accords d’échange de renseignements transfrontaliers et les répercussions afférentes sur le plan de la protection des renseignements personnels.",A-2016-07574,Canada Border Services Agency | Agence des services frontaliers du Canada,2017-02,TRUE,TRUE,text,TRUE,TRUE
CBSA_A-2016-07582,atip-files/CBSA ATIPS/CBSA_A-2016-07582.pdf,"Briefing note from April 23, 2014 to update the President of the Canada Border Services Agency on the use of predictive analytics for pre-arrival risk assessment in the traveler stream, file number CBSA/ASFC-15-01905.

Note d'information du 23 avril 2014 pour renseigner le président de l'Agence des services frontaliers du Canada sur l'utilisation de l'analytique prédictive pour l'évaluation des risques avant l'arrivée dans la filière des voyageurs, dossier numéro CBSA/ASFC-15-01905.",A-2016-07582,Canada Border Services Agency | Agence des services frontaliers du Canada,2017-03,TRUE,TRUE,text,TRUE,TRUE
CBSA_A-2016-08927,atip-files/CBSA ATIPS/CBSA_A-2016-08927.pdf,"Records from April 1, 2015 to July 4, 2016 circulated to senior Canada Border Services Agency (CBSA) officials concerning information-sharing with foreign entities involving substantial risk of mistreatment pursuant to the terms of the Ministerial direction to the CBSA on Information Sharing with Foreign Entities.

Documents couvrant la période qui s’étend du 1eravril 2015 au 4 juillet 2016, qui ont été transmis aux hauts responsables de l’Agence des services frontaliers du Canada (ASFC) concernant l’échange d’information avec des entités étrangères qui comprend un risque important de mauvais traitements conformément à l’orientation ministérielle à l’intention de l’ASFC sur l’échange d’information avec des entités étrangères.",A-2016-08927,Canada Border Services Agency | Agence des services frontaliers du Canada,2017-02,TRUE,TRUE,text,TRUE,TRUE
CBSA_A-2016-10066,atip-files/CBSA ATIPS/CBSA_A-2016-10066.pdf,"Records from January 1, 2010 to July 25, 2016, including briefing notes, policies, directives, studies or reports relating to the removal of individuals from Canada to the Democratic Republic of the Congo (DRC). This includes any follow-up on those removed by the Canada Border Services Agency, the assistance provided on arrival at the DRC airport and whether those removed were detained by Congolese authorities upon arrival.

Documents du 1er janvier 2010 au 25 juillet 2016, y compris les notes d’information, les politiques, les directives, les études ou les rapports concernant le renvoi de personnes du Canada vers la République démocratique du Congo (RDC). Cela comprend tout suivi des personnes qui ont été renvoyées par l’Agence des services frontaliers du Canada, l’assistance fournie à leur arrivée à l’aéroport de la RDC et la question de savoir si les personnes renvoyées ont été détenues par les autorités congolaises à leur arrivée.",A-2016-10066,Canada Border Services Agency | Agence des services frontaliers du Canada,2021-08,TRUE,TRUE,text,TRUE,TRUE
CBSA_A-2016-10155,atip-files/CBSA ATIPS/CBSA_A-2016-10155.pdf,"The following Briefing Notes: 15-03211 - Audit by the Office of the Privacy Commissioner: Privacy and Portable Storage Devices; 15-05439 - Initial of Interchange Canada Assignment of Conway Griddell-Gray; 15-05470 - Issues Impacting The Minister's Riding; 15-05516 - High Profile Cases; 15-05693 – Temporary suspensions of removals Update: Haiti and Zimbabwe; 15-05727 - Recognition Event Marking the Decommissioning of the Field Operations Support System Package; 15-05805 - PO Tasking: Update on Van Heest Case; 15-05841 - Request for Canadian Armed Forces Assistance for Irregular Marine Arrivals; 16-00263 – Memorandum of Understanding between Immigration, Refugees and Citizenship Canada , the Canada Border Services Agency and the Immigration and Refugee Board of Canada; BN-16-00133 - National Criminal Investigations Workshop; and 16-00318 - Shared Services Canada Aging Infrastructure Letter and Briefing Note.

Les notes d’information suivantes : 15-03211 – Rapport de vérification du Bureau du commissaire à la protection de la vie privée : Protection de la vie privée et dispositifs de stockage portables; – 15-05439 – Paraphe de l’affectation de Conway Griddell-Gray dans le cadre du programme Échanges Canada; 15-05470, – Questions touchant la circonscription du ministre; 15-05516 – Cas très médiatisés; 15-05693 – Mise à jour au sujet des suspensions temporaires des renvois : Haïti et Zimbabwe; 15-05727 – Évènement de reconnaissance soulignant la mise hors service du progiciel du système de soutien des opérations des bureaux locaux; 15-05805 – Attribution de commandes du BP : Le point sur l’affaire Van Heest; 15-05841 – Demande d’assistance des Forces armées canadiennes pour l’afflux d’arrivée irrégulière par la voie maritime; 16-00263 – Protocole d’entente entre Immigration, Réfugiés et Citoyenneté Canada, l’Agence des services frontaliers du Canada et la Commission de l’immigration et du statut de réfugié du Canada; BN-16-00133 – Atelier national sur les enquêtes criminelles; 16-00318 – Lettre et notes d’information de Services partagés Canada sur les infrastructures vieillissantes.",A-2016-10155,Canada Border Services Agency | Agence des services frontaliers du Canada,2020-02,TRUE,TRUE,text,TRUE,TRUE
CBSA_A-2016-11808,atip-files/CBSA ATIPS/CBSA_A-2016-11808.pdf,"Briefing materials provided to the President of the Canada Border Services Agency: 16-02611 - Deck for Minister's Briefing on June 03, 2016, National Security Related Ministerial Directives; 16-02657 -Preclearance Legislation Briefing Binder; 16-02748 – Deputy Minister Conference call with the Chief Human Resources officer on June 27, 2016; 16-02837 - Canadian Red Cross Society's Immigration Detention Monitoring Program; 16-02849 -Standing Committee on Public Safety and National Security - Follow-up to Committee; 16-02981 - Meeting with Canada Post on August 24, 2016; 16-03183 - National Immigration Detention Program Governance; and 16-03235 –Deputy Minister meeting with the Public Services and Procurement Canada on Postal Modernization.

Les documents d’information à l’intention du président de l’Agence des services frontaliers du Canada : 16-02611 – Dossier de présentation pour l’exposé du ministre le 3 juin 2016, directives ministérielles concernant la sécurité nationale; 16-02657 – Cahier d’information au sujet de la législation sur le précontrôle; 16-02748 – Conférence téléphonique du sous-ministre avec le dirigeant principal des ressources humaines le 27 juin 2016; 16-02837 – Programme de suivi des conditions de détention des immigrants de la Société canadienne de la Croix-Rouge; 16-02849 – Comité permanent de la sécurité publique et nationale – Suivi à l’intention du comité; 16-02981 – Rencontre avec Postes Canada le 24 août 2016; 16-03183 – Gouvernance du programme en matière de détention liée à l’immigration; 16-03235 – Rencontre entre le sous-ministre et Services publics et Approvisionnement Canada au sujet de la modernisation des opérations postales.",A-2016-11808,Canada Border Services Agency | Agence des services frontaliers du Canada,2020-02,TRUE,TRUE,text,TRUE,TRUE
CBSA_A-2016-13039,atip-files/CBSA ATIPS/CBSA_A-2016-13039.pdf,"The following Briefing Notes: 16-00476 - Mutual Recognition Arrangement Prioritization, Privacy, and Engagement with China; 16-00593 - Information Memo to the Vice President: Programs Engagement with China; 16-00617 - 13th Annual Canada/China Working Group on Law Enforcement; 16-00981 - President’s Office Tasking: For the Minister: Update on Work with China; 16-01683 - Memorandum on the Access to Information and Privacy Compliance and Backlog; 15-01917 - Operation Steel Border; 16-01947 - Small and/or Remote Ports of Entry Service Delivery Framework; 16-01948 - 2014-2015 Report on the Beyond the Border Action Plan Horizontal Initiative; 16-01950 - International to Domestic Baggage Connection Process; 16-02075 - Proposed Amendment to the Surveillance Policy; 16-02083 - For Approval: Federal Bureau of Investigation and Canada Border Services Agency Memorandum of Understanding Implementation; 16-02195 - Status of the Access to Information and Privacy’s Review of Transition Documents; 16-02538 CBSA - Trends Report - for 2015-2016; 16-02540 - Entry / Exit Technical Briefing Presentation; 16-02601 - For Information: Cabinet Affairs Questions on Detention; 16-02731 – The Canada Border Services Agency Trends Report, April 2016-2017; 16-02754 - For the President – Joint Border Strategy: Action Plan Update.

Les notes d’information suivantes : 16-00476 - Accord de reconnaissance mutuelle - Établissement des priorités, protection des renseignements personnels et engagement avec la Chine; 16-00593 - Note d’information au vice-président : Mobilisation des programmes avec la Chine; 16-00617 - 13e réunion annuelle du Groupe de travail Canada-Chine sur l’application de la loi; 16-00981 - Tâche du bureau du président : Pour le ministre : Mise à jour sur les travaux avec la Chine; 16-01683 - Note d’information sur la conformité et l’arriéré en matière d’accès à l’information et de protection des renseignements personnels; 15-01917 - Opération Steel Border; 16-01947 - Cadre de prestation de services pour les points d’entrée de petite taille et/ou éloignés; 16-01948 - Rapport sur l’initiative horizontale du Plan d’action Par-delà la frontière 2014-2015; 16-01950 - Processus de traitement des bagages lors de transferts d’un vol international à un vol intérieur; 16-02075 - Modification proposée à la Politique de surveillance; 16-02083 - Pour approbation : Mise en œuvre du protocole d’entente entre le Bureau fédéral des enquêtes et l’Agence des services frontaliers du Canada; 16-02195 - État d’avancement de l’examen des documents de transition sur l’accès à l’information et la protection des renseignements personnels; 16-02538 ASFC - Rapport sur les tendances - pour 2015-2016; 16-02540 - Exposé technique sur les entrées et les sorties; 16-02601 - Pour information : Questions des Affaires du Cabinet sur la détention; 16-02731 – Rapport sur les tendances de l’Agence des services frontaliers du Canada, avril 2016-2017; 16-02754 – Pour le président – Stratégie frontalière conjointe : Mise à jour sur le Plan d’action.",A-2016-13039,Canada Border Services Agency | Agence des services frontaliers du Canada,2020-01,TRUE,TRUE,text,TRUE,TRUE
CBSA_A-2016-17126,atip-files/CBSA ATIPS/CBSA_A-2016-17126.pdf,"The security volume from the Canada Border Services Agency Screening Manual.

Le volume sur la sécurité tiré du Manuel de contrôle de l’Agence des services frontaliers du Canada.",A-2016-17126,Canada Border Services Agency | Agence des services frontaliers du Canada,2020-07,TRUE,TRUE,text,TRUE,TRUE
CBSA_A-2017-00503,atip-files/CBSA ATIPS/CBSA_A-2017-00503.pdf,"A copy of the June 2013 standard operating procedures for lookouts.

Une copie des procédures normales d’exploitation de juin 2013 sur les avis de surveillance.",A-2017-00503,Canada Border Services Agency | Agence des services frontaliers du Canada,2020-07,TRUE,TRUE,text,TRUE,TRUE
CBSA_A-2017-02530,atip-files/CBSA ATIPS/CBSA_A-2017-02530.pdf,"Records including emails, reports, and memoranda regarding the updates to the Canada Border Services Agency website on January 6, 2017, that included the “Be aware and declare” section. This includes: the specific reasons for undertaking these updates, how the updated content was chosen and approved, and how, when and by whom the initial decision to update was reached. Additionally any correspondence pertaining to if these activities were conducted in consultation with or at the request of the Minister of Public Safety and Emergency Preparedness.

Dossiers incluant les courriels, les rapports et les mémorandums concernant les mises à jour apportées au site Web de l’Agence des services frontaliers du Canada le 6 janvier 2017, notamment sur la section « Pensez-y et déclarez! ». Les renseignements demandés sont : les raisons précises ayant poussé à apporter ces modifications; comment le contenu mis à jour a été choisi et approuvé; et comment, quand et par qui la décision initiale de mettre à jour le site Web a été prise. De plus, si ces activités ont été réalisées en collaboration avec le ministre de la Sécurité publique et de la Protection civile ou à sa demande, toute correspondance à ce sujet.",A-2017-02530,Canada Border Services Agency | Agence des services frontaliers du Canada,2020-05,TRUE,TRUE,text,TRUE,TRUE
CBSA_A-2017-04155,atip-files/CBSA ATIPS/CBSA_A-2017-04155.pdf,"Records prepared from February 1 to March 15, 2017, for the President of the Canada Border Services Agency, John Ossowski, on the subject of asylum seekers between ports of entry. This excludes emails.

Dossiers préparés du 1er février au 15 mars 2017 pour le président de l’Agence des services frontaliers du Canada, John Ossowski, au sujet des demandeurs d’asile entre les points d’entrée. Les courriels sont exclus.",A-2017-04155,Canada Border Services Agency | Agence des services frontaliers du Canada,2020-06,TRUE,TRUE,text,TRUE,TRUE
